node,type,area,position,group,education,employer,political party,religion,reference,comments,membership,seat,,
Olivier Dussopt,people,Gouvernement,Secrétaire d’État auprès du ministre de l’Action et des Comptes publics,Action comptes publics,IEP Grenoble,,Parti socialiste,,,Grand Orient de France (pas sûr pour le GODF),Intergroupe de la LICRA,,,
Gérald Darmanin,people,Gouvernement,Ministre de l'action et des comptes publics,Action comptes publics,IEP Lille,,Les Républicains,,420,Judaïsme,,,,
Mathieu Lefevre,people,Gouvernement,Chef de cabinet et conseiller en charge de la synthèse budgétaire,Action comptes publics,,,Les Républicains,,,,,,,
Christophe Guérin-Linxe,people,Gouvernement,"Chef de cabinet, conseiller spécial du secrétaire d'Etat, conseiller presse et communication",Action comptes publics,,,Parti socialiste,,,,,,,
Cécile Collin,people,Gouvernement,Conseillère auprès du ministre de l'action et des comptes publics,Action comptes publics,,"Havas, CSC",Les Républicains,,,,,,,
Florian Colas,people,Gouvernement,Conseiller,Action comptes publics,"Sciences Po Paris, ENA (promotion Marie Curie)","Wendel, Inspection Générale des Finances, Astrium, Lafarge, Lehman Brothers",,,,,,,,
Arnaud Wieber,people,Gouvernement,Conseiller au cabinet du ministre de l'action et des comptes publics,Action comptes publics,Sciences Po Bordeaux,"Sénat, Assemblée nationale, Conseil de l'Europe",,,,,,,,
Renan Megy,people,Gouvernement,"Conseiller budgétaire et fiscal, en charge de la fonction publique territoriale et du suivi de l'exécution des réformes",Action comptes publics,,"Chambre régionale des comptes, Métropole Européenne de Lille, Grand Lyon, communauté urbaine",,,,,,,,
Matthieu Ellerbach,people,Gouvernement,"Conseiller en charge de la communication, de la presse et de l'opinion",Action comptes publics,Sciences Po Paris,Brunswick Group,Les Républicains,,,,,,,
Alexandre Brugère,people,Gouvernement,Conseiller en charge de la réforme de l'Etat et du suivi de l'exécution des réformes,Action comptes publics,,Eurogroup Consulting,Les Républicains,,,,,,,
Louis d'Humières,people,Gouvernement,Conseiller en charge du budget de l'État,Action comptes publics,"HEC, École de guerre",Rothschild (stagiaire),,,,,,,,
Clément Méric,people,Gouvernement,Conseiller technique en charge des déplacements et de la presse,Action comptes publics,,,,,,,,,,
Pauline Hodille,people,Gouvernement,Conseillère en charge des comptes sociaux,Action comptes publics,ENA,,,,,,,,,
Élise Valetoux,people,Gouvernement,Conseillère en charge des relations avec le Parlement et de la fiscalité,Action comptes publics,,Assemblée nationale,,,,,,,,
Elsa Michonneau,people,Gouvernement,"Conseillère parlementaire, en charge des relations avec les élus et les territoires",Action comptes publics,,"Assemblée nationale  (collaboratrice parlementaire de Bruno Studer et de Olivier Dussopt), Métropole de Lyon, Ministère de la Ville, de la Jeunesse et des Sports, Assemblée nationale (collaboratrice parlementaire de Thierry Braillard, puis de Gilda Hobert)",Parti radical de gauche,,,,,,,
Alain Triolle,people,Gouvernement,"Directeur de cabinet, en charge du suivi de la réforme des retraites",Action comptes publics,ENA (promotion Antoine de Saint-Exupéry),,,,,,,,,
Jérôme Fournel,people,Gouvernement,Directeur du Cabinet,Action comptes publics,"ENA, HEC",FMI,Les Républicains,,,,,,,
Marine Darnault,people,Gouvernement,"Directrice adjointe de cabinet, en charge de la fonction publique",Action comptes publics,"ENA, ESSEC, Sciences Po Paris","Musée de l'Armée, Réunion des Musées Nationaux, Direction générale de la cohésion sociale",,,,,,,,
Justine Coutard,people,Gouvernement,Directrice du cabinet,Action comptes publics,"Sciences Po Paris, ENA","Groupe ADP, Inspection des finances",,,,,,,,
Jean-Yves Le Drian,people,Gouvernement,Ministre de l'Europe et des affaires étrangères,Affaires étrangères,,,Parti socialiste,,347,Grand Orient de France,,,,
Joachim Bokobza,people,Gouvernement,"Conseiller commerce extérieur, politique commerciale, tourisme, budget",Affaires étrangères,"Corps des Mines, Mines ParisTech, Princeton University, Polytechnique","Direction générale du Trésor, Commission européenne, BNP Paribas (stagiaire)",,,,Judaïsme,,,,
François Decoster,people,Gouvernement,Directeur de cabinet,Affaires étrangères,Sciences Po Paris,"Communauté d'Agglomération du Pays de Saint-Omer, Le Comité européen des régions, Hill+Knowlton Strategies",,,,Membre du Rotary,,,,
Margaux Bergeon-Dars,people,Gouvernement,"Conseillère Europe continentale, Nations unies et organisations internationales",Affaires étrangères,"ENS, Sciences Po Paris",,,,,Parle l'hébreux... (c'est indiqué sur son profil LinkedIn),,,,
Laurent Doraï,people,Gouvernement,Directeur adjoint du cabinet du secrétaire d'Etat,Affaires étrangères,,"Philip Morris, Assemblée nationale (Directeur de cabinet adjoint de Claude Bartolone)",Parti socialiste,,,,,,,
Arnaud Jayet,people,Gouvernement,Chef de cabinet,Affaires étrangères,,,Les Républicains,,,,,,,
Fanny Demassieux,people,Gouvernement,Chef du cabinet,Affaires étrangères,IEP Grenoble,"UNEP, Agence Française de Développement",Parti socialiste,,,,,,,
Simond de Galbert,people,Gouvernement,"Conseiller affaires stratégiques, Amériques",Affaires étrangères,"Ena, Sciences Po Paris",,,,,,,,,
Olivier Decottignies,people,Gouvernement,"Conseiller Afrique du Nord, Moyen-Orient",Affaires étrangères,"ENS, Sciences Po Paris, EHESS",,,,,,,,,
Jérémie Robert,people,Gouvernement,"Conseiller Afrique, développement",Affaires étrangères,,,,,,,,,,
Augustin Favereau,people,Gouvernement,"Conseiller diplomatie culturelle, influence, francophonie, chargé du suivi de l'exécution des réformes",Affaires étrangères,"Sciences Po Paris, Freie Universität Berlin","Ministère des Affaires étrangères, EUNIC, Consulat général de France à Jérusalem, Ministère de l'Agriculture, Ministère allemand des affaires étrangères",,,,,,,,
Baptiste Prudhomme,people,Gouvernement,Conseiller politique et parlementaire,Affaires étrangères,,,Parti socialiste,,,,,,,
Myriam Pavageau,people,Gouvernement,"Conseillère affaires stratégiques, Asie",Affaires étrangères,Sciences Po Paris,,,,,,,,,
François Courant,people,Gouvernement,"Conseiller chargé des affaires diplomatiques, des Français de l'étranger, du développement et de la francophonie",Affaires étrangères,,,,,,,,,,
Camille Petit,people,Gouvernement,"Conseillère Asie, affaires juridiques et consulaires",Affaires étrangères,,,,,,,,,,
Véronique Le Goff,people,Gouvernement,Conseillère communication et presse,Affaires étrangères,,"Havas, Groupama",Parti socialiste,,,,,,,
Nathalie Fortis,people,Gouvernement,"Conseillère auprès du secrétaire d'État, chargée de la communication et des relations avec la presse",Affaires étrangères,,,,,,,,,,
Constance Jacquin,people,Gouvernement,Conseillère en charge des relations politiques et parlementaires,Affaires étrangères,,,Les Républicains,,,,,,,
Charlotte Baratin,people,Gouvernement,"Conseillère questions financières, budgétaires, économiques, agricoles et outre-mer",Affaires étrangères,"ENS, ENA (promotion Jean de la Fontaine)","TheFamily, La Banque Postale, Parlement européen",,,,,,,,
Emmanuel Puisais-Jauvin,people,Gouvernement,Directeur adjoint de cabinet,Affaires étrangères,,,,,,,,,,
Luis Vassy,people,Gouvernement,Directeur de cabinet,Affaires étrangères,"ENS, Sciences Po Paris, ENA",,Parti socialiste,,415,,,,,
Nicolas Roche,people,Gouvernement,Directeur de cabinet du ministre,Affaires étrangères,"Ecole des Chartes, Sciences Po Paris, ENA",,,,,,,,,
Jean-Baptiste Lemoyne,people,Gouvernement,Secrétaire d'État auprès du ministre de l'Europe et des Affaires étrangères,Affaires étrangères,"St Cyr, ESSEC, IEP Strasbourg",IBM Global Services,Les Républicains,,458,,,,,
Amélie de Montchalin,people,Gouvernement,"Secrétaire d'Etat auprès du ministre de l'Europe et des Affaires étrangères, chargée des Affaires européennes",Affaires européennes,"HEC, Harvard Kennedy School of Government","BNP Paribas, Axa",Les Républicains,,,Young Leaders 2018,Intergroupe de la LICRA,,Essonne,Ile-de-France
Camille Angué,people,Gouvernement,"Chef de cabinet, conseillère en charge des relations avec le Royaume-Uni, les entreprises et la société civile",Affaires européennes,HEC,,,,,,,,,
Michele Ferrari,people,Gouvernement,Conseiller diplomatique,Affaires européennes,,,,,,,,,,
Antonin Ferri,people,Gouvernement,"Conseiller marché intérieur, développement durable et politiques sociales",Affaires européennes,"Mines ParisTech, MIT, ENS",Commission européenne,,,,,,,,
Niels Gaubert,people,Gouvernement,"Conseiller spécial, communication et presse, en charge des relations avec le Parlement",Affaires européennes,Sciences Po Paris,"Havas, Cour des comptes",Les Républicains,,,,,,,
Justine Dalphin,people,Gouvernement,Conseillère politiques territoriales et en charge du suivi de l'exécution des réformes,Affaires européennes,"Département de l’Essonne, Commune de Mantes-la-Jolie",,,,,,,,,
Christophe Parisot,people,Gouvernement,Directeur adjoint de cabinet et conseiller chargé des affaires européennes,Affaires européennes,,,,,,,,,,
Boris Melmoux-Eude,people,Gouvernement,Directeur de cabinet,Affaires européennes,"Sciences Po Paris, ENA","Haute Autorité de transparence de la vie publique, Cour des comptes",,,,,,,,
Guillaume Macher,people,Gouvernement,"Chef de cabinet, conseiller spécial",Agriculture,Master IPAG,,Parti socialiste,,,,,,,
Benoît Bonaimé,people,Gouvernement,Directeur adjoint,Agriculture,,,,,,,,,,
Mathias Ginet,people,Gouvernement,"Conseiller en charge des transitions agro-écologiques, de la politique agricole commune et des filières végétales",Agriculture,"ENS, Sciences Po Paris, ENA (promotion Jean Zay)","Air Liquide, OMC, Alternatives Economiques",,,,,,,,
Olivier Alleman,people,Gouvernement,Conseiller presse et communication,Agriculture,,"France Télévision, Europe 1",,,,,,,,
Anne Bronner,people,Gouvernement,"Conseillère en charge de la qualité, de la performance et de la sécurité sanitaire de l'alimentation, du suivi du plan de sortie des produits phytosanitaires, du bien-être animal et de la lutte contre la maltraitance animale",Agriculture,,,,,,,,,,
Nathalie Barbe,people,Gouvernement,"Conseillère en charge des filières animales, du suivi des Etats Généraux de l'alimentation et des plans de filières, de la forêt et de la performance économique des entreprises agricoles et agroalimentaires",Agriculture,,,,,,,,,,
Bénédicte Bergeaud,people,Gouvernement,Conseillère en charge des relations avec le Parlement,Agriculture,,Anthenor Public Affairs,,,,,,,,
Béatrice Frécenon,people,Gouvernement,Directrice de cabinet,Agriculture,,,Parti socialiste,,,,,,,
Didier Guillaume,people,Gouvernement,Ministre de l'agriculture et de l'alimentation,Agriculture,,,Parti socialiste,,,,,,,
Julien Denormandie,people,Gouvernement,"Ministre auprès de la ministre de la Cohésion des territoires et des Relations avec les collectivités territoriales, chargé de la Ville et du Logement",Cohésion des Territoires,"INA Paris-Grignon, Génie rural",,Parti socialiste,,437,Homosexuel,,,,
Soraya Hamrioui,people,Gouvernement,"Conseillère budgétaire, finances",Cohésion des Territoires,,,Parti socialiste,,,Pas sûr pour la photo...,,,,
Anne-Caroline Berthet,people,Gouvernement,Chef de Cabinet,Cohésion des Territoires,,,Union des démocrates et indépendants,,,,,,,
Victor Schmidt,people,Gouvernement,Chef de cabinet,Cohésion des Territoires,,,Parti socialiste,,445,,,,,
Guillaume Rivalland,people,Gouvernement,"Chef de cabinet, conseiller affaires réservées",Cohésion des Territoires,,,Les Républicains,,,,,,,
Koumaran Pajaniradja,people,Gouvernement,"Conseiller aménagement, construction, urbanisme et transition énergétique",Cohésion des Territoires,,Météo-France,,,,,,,,
Nicolas Mazières,people,Gouvernement,Conseiller chargé des relations avec le Parlement et les élus,Cohésion des Territoires,,,,,,,,,,
Cédric Loret,people,Gouvernement,Conseiller chargé du suivi de l'exécution des réformes et du logement,Cohésion des Territoires,,Direction Régionale et Interdépartementale de l'Hébergement et du Logement,,,,,,,,
Sébastien Bécoulet,people,Gouvernement,Conseiller politique de la ville et hébergement d'urgence,Cohésion des Territoires,ENA,,,,,,,,,
Ziad Gebran,people,Gouvernement,Conseiller presse et communication,Cohésion des Territoires,Sciences Po Paris,,,,,,,,,
Olivier Bouchery,people,Gouvernement,"Conseiller spécial, politiques publiques territoriales, outre-mer",Cohésion des Territoires,Sciences Po Paris,"L'Oréal, EADS",Les Républicains,,,,,,,
Marie Dousset,people,Gouvernement,Conseillère affaires parlementaires et législatives,Cohésion des Territoires,,France Télévisions,Union des démocrates et indépendants,,,,,,,
Juliette Part,people,Gouvernement,"Conseillère aménagement du territoire, chargée du suivi de l'exécution des réformes",Cohésion des Territoires,"Sciences Po Paris, ENA",,,,,,,,,
Pauline Malet,people,Gouvernement,Conseillère collectivités et institutions locales,Cohésion des Territoires,,,Parti socialiste,,,,,,,
Laetitia Cesari-Giordani,people,Gouvernement,Conseillère financière et budgétaire,Cohésion des Territoires,ENA,"Direction du Budget, Cour des comptes",,,,,,,,
Léa Roussarie,people,Gouvernement,Conseillère parlementaire et relations avec les élus,Cohésion des Territoires,Sciences Po Paris,"Comfluence, Boury Tallon & Associés, BNP Paribas",Union des démocrates et indépendants,,,,,,,
Agnès Callou,people,Gouvernement,Conseillère presse et communication,Cohésion des Territoires,,,Mouvement démocrate,,,,,,,
Julie Lavet,people,Gouvernement,Conseillère spéciale,Cohésion des Territoires,,,Parti socialiste,,,,,,,
Marc Chappuis,people,Gouvernement,Directeur adjoint du cabinet,Cohésion des Territoires,"Sciences Po Paris, INET",,,,,,,,,
David Carmier,people,Gouvernement,Directeur adjoint du cabinet,Cohésion des Territoires,"ENA, HEC, Sciences Po Paris","Tribunal administratif de Paris, Sénat (collaborateur parlementaire de Dominique Leclerc)",Les Républicains,,,,,,,
Cécile Raquin,people,Gouvernement,Directeur de cabinet,Cohésion des Territoires,ENA (2006-2008),Conseil d'État,,,,,,,,
Fabrice Rigoulet-Roze,people,Gouvernement,Directeur du cabinet,Cohésion des Territoires,"ENA (promotion Victor Schoelcher), ESSEC, Science Po Paris","Préfet de Charente-Maritime, Préfet de Martinique",Parti socialiste,,,,,,,
Renaud Duplay,people,Gouvernement,Directeur du cabinet,Cohésion des Territoires,ENS,"Direction du Budget, FMI, Eurazeo",,,,,,,,
Yohann Marcon,people,Gouvernement,Conseiller finances locales,Cohésion des Territoires,"ENA (2014-2015), Sciences Po Paris",Ministère de l'Intérieur,,,,,,,,
Bertrand Nicolle,people,Gouvernement,Conseiller analyse territoriale et prospective,Cohésion des Territoires,Ponts ParisTech,"Ordre des architectes d'Île-de-France, Métropole de Lyon",,,,,,,,
Rachel Chane-See-Chu,people,Gouvernement,Directrice adjointe du cabinet,Cohésion des Territoires,,SNCF,,,,,,,,
Sébastien Lecornu,people,Gouvernement,"Ministre auprès de la ministre de la Cohésion des territoires et des Relations avec les collectivités territoriales, chargé des Collectivités territoriales",Cohésion des Territoires,ENA,Gendarmerie Nationale,Les Républicains,,413,,,,,
Jacqueline Gourault,people,Gouvernement,Ministre de la Cohésion des territoires et des Relations avec les collectivités territoriales,Cohésion des Territoires,,,Mouvement démocrate,,,,,,,
Franck Riester,people,Gouvernement,Ministre de la culture,Culture,,"EY, Peugeot",Union des démocrates et indépendants,,458,Homosexuel,,,,
Déborah Münzer,people,Gouvernement,"Conseillère en charge de l’action territoriale, de l’éducation artistique et culturelle, de l’enseignement supérieur et de la recherche",Culture,MBA ESSEC,"Mairie de Paris, BAC Films, Assouline Publishing",Les Républicains,,429,Judaïsme,,,,
Jean-Baptiste de Froment,people,Gouvernement,"Conseiller spécial, en charge du patrimoine et de l'architecture, et de la prospective",Culture,"ENS, Freie Universität Berlin","Métropole du Grand Paris, Ville De Paris, Conseil d'État, Conseiller à Présidence de la République (Nicolas Sarkozy)",Les Républicains,,,Lauréat de la Fondation Thiers,,,,
Ludovic Guillot,people,Gouvernement,"Conseiller en charge de la communication, des relations avec la presse et des relations institutionnelles",Culture,,,Les Républicains,,,,,,,
Simon Garcia,people,Gouvernement,"Conseiller en charge de la transformation du ministère, du budget et de la fiscalité, et du suivi de l'exécution des réformes",Culture,"Sciences Po Paris, ENA",,,,,,,,,
Pierre-Louis Lagnau,people,Gouvernement,Chef de cabinet,Culture,Sciences Po Paris,"Tickasso, Ministère de la Culture",,,,,,,,
Matthias Grolier,people,Gouvernement,"Conseiller auprès du ministre, en charge des affaires internationales, de la langue française et de la francophonie, du livre et de la lecture",Culture,HEC,"Gide Loyrette Nouel, Jones Day, Morgan, Lewis & Bockius",,,,,,,,
Quentin Bataillon,people,Gouvernement,Conseiller politique et parlementaire,Culture,,,Les Républicains,,,,,,,
Leïla Derouich,people,Gouvernement,"Directrice adjointe de cabinet, en charge des médias et des industries culturelles",Culture,"Sciences Po Paris, ENA (promotion Jean-Jacques Rousseau)",CSA,,,,,,,,
Lucie Muniesa,people,Gouvernement,Directrice du cabinet,Culture,ENSAE,"Radio France, Agence des participations de l'Etat",Parti socialiste,,458,,,,,
Juliette Oury,people,Gouvernement,Conseillère affaires européennes et internationales,Économie,"Ponts et Chaussées, Sciences Po Paris, ENA","Direction générale du Trésor, Commission européenne",,,,Judaïsme ?,,,,
Clémence Midière,people,Gouvernement,Conseillère technique presse,Économie,,"Ministère de l’Economie et des Finances, 2017 (cabinet de conseil en stratégie et communication fondé par Roman Abreu, Gaspard Gantzer et Denis Pingaud), TNP Consultants",,,,Resto du Coeur,,,,
Jennifer Pizzicara,people,Gouvernement,"Chef de cabinet, en charge des relations avec le Parlement et de l'exécution des réformes",Économie,IEP Aix-en-Provence,,,,,,,,,
Emmanuel Monnet,people,Gouvernement,Conseiller financement de l'économie,Économie,"ENS, Sciences Po Paris, ENA","Direction générale du Trésor, Inspection générale des finances, Commission européenne",,,,,,,,
Charles Sitzenstuhl,people,Gouvernement,"Conseiller politique, en charge du numérique et de la transition écologique",Économie,"IEP Strasbourg, Doctorat Sciences Po Paris",,,,,,,,,
Dimitri Lucas,people,Gouvernement,Conseiller presse et communication,Économie,,,Les Républicains,,,,,,,
Yves-Marie Cann,people,Gouvernement,Conseiller presse et communication,Économie,,"Assemblée nationale (Conseiller en charge de la communication de François de Rugy), ELABE, CSA, IFOP",,,,,,,,
Aigline de Ginestous,people,Gouvernement,Conseillère en charge du suivi de l'exécution des réformes prioritaires,Économie,,"Rothschild, Lehman Brothers, Société Générale, Airbus",,,,,,,,
Magali Valente,people,Gouvernement,Conseillère fiscalité et chargée des relations avec le Parlement,Économie,EHESP,CSA,Les Républicains,,,,,,,
Thomas Revial,people,Gouvernement,Directeur adjoint du cabinet,Économie,"Polytechnique, ENA","Direction générale du Trésor, France Stratégie, Inspection des finances, Banque mondiale, Conseil de l'Union européenne",,,,,,,,
Aloïs Kirchner,people,Gouvernement,Directeur du cabinet,Économie,"Polytechnique, Corps des mines","Inspection des finances, ESL & Network",,,,,,,,
Dorothée Rouzet,people,Gouvernement,Conseillère en charge de la macroéconomie,Économie,Harvard,"OCDE, Direction générale du Trésor",,,,,,,,
Pierre-Étienne Girardot,people,Gouvernement,"Conseiller industrie, innovation et Télécoms au cabinet de la secrétaire d'État auprès du ministre de l'économie et des finances",Économie,"Polytechnique, Corps des mines",,,,,,,,,
Cédric Garcin,people,Gouvernement,"Conseiller entreprises, pacte productif et participations de l'État",Économie,"ENA (promotion Robert Badinder), HEC","Grand Port Maritime de Marseille, Aéroport Marseille Provence, SNCF, Agence des participations de l'État, LFB, Inspection des finances, Direction générale du Trésor",,,,,,,,
Emmanuel Moulin,people,Gouvernement,Directeur du cabinet,Économie,"Sciences Po Paris, ESSEC, ENA (promotion Victor Schœlcher)","Mediobanca, Banque mondiale, Citigroup, Groupe Eurotunnel, Club de Paris",Les Républicains,,"440, 442",,,,,
Bruno Le Maire,people,Gouvernement,Ministre de l'économie et des finances,Économie,"ENS, Sciences Po Paris, ENA (promotion Valmy), agrégé de lettres",,Les Républicains,,267,,,,,
Agnès Pannier-Runacher,people,Gouvernement,Secrétaire d’État auprès du ministre de l’Économie et des Finances,Économie,"HEC, Sciences-Po Paris, ENA (promotion Averroès)","Bourbon, Fonds Stratégique d'Investissement, Caisse des dépôts, Crédit Agricole",,,,,,,,
Stéphane Robin,people,Gouvernement,Conseiller budgétaire et numérique,Éducation nationale,,,,,,Aucune information sur lui en ligne,,,,
Jean-Michel Blanquer,people,Gouvernement,Ministre de l'Éducation nationale et de la Jeunesse,Éducation nationale,Sciences Po Paris,ESSEC,Les Républicains,,365,Grande Loge de France https://blogs.lexpress.fr/lumiere-franc-macon/2017/11/26/blanquer-son-show-chez-les-freres-gldf,,,,
Gabriel Attal,people,Gouvernement,Secrétaire d’État auprès du ministre de l’Éducation nationale et de la Jeunesse,Éducation nationale,Sciences Po Paris,Académie de France à Rome - Villa Médicis,Parti socialiste,,458,"Judaïsme, Homosexuel, pacsé avec Stéphane Sejourné",,,,
Christophe Pacohil,people,Gouvernement,Chef de Cabinet,Éducation nationale,,ESSEC,Les Républicains,,,,,,,
Jérémy Coste,people,Gouvernement,"Chef de cabinet, conseiller parlementaire",Éducation nationale,,"Conseil départemental de l'Allier, Ville de Nouméa, Société du Grand Paris, Assemblée nationale (Collaborateur parlementaire d'André Santini)",Union des démocrates et indépendants,,,,,,,
Louis Jublin,people,Gouvernement,"Conseiller auprès du secrétaire d'État, en charge de la communication et de la presse",Éducation nationale,,"Albera Conseil, Havas",Les Républicains,,,,,,,
Benoît Coquille,people,Gouvernement,Conseiller chargé de la jeunesse et du suivi de l'exécution des réformes,Éducation nationale,"Sciences Po Paris, London School of Economics","Ministère de l'Éducation nationale, Centre des Jeunes Dirigeants d'entreprise, MGEN, Renault",,,,,,,,
Matthieu Lahaye,people,Gouvernement,Conseiller en charge des affaires pédagogiques,Éducation nationale,,,,,,,,,,
Richard Senghor,people,Gouvernement,Conseiller spécial,Éducation nationale,,"Conseil d'Etat, Le Défenseur des droits",Les Républicains,,,,,,,
Thierry Ledroit,people,Gouvernement,Conseiller territoires et politiques interministérielles,Éducation nationale,,,,,,,,,,
Anna-Livia Susini-Collomb,people,Gouvernement,Conseillère diplomatique,Éducation nationale,,,,,,,,,,
Marie Ameller,people,Gouvernement,Conseillère en charge des discours et de la culture,Éducation nationale,ESSEC,"Ministère de la Culture, Alliance Française — Ambassade de France en Uruguay, Musée national Picasso-Paris",,,,,,,,
Marie Dutertre,people,Gouvernement,Conseillère en charge du suivi de l'exécution des réformes et de la transition écologique,Éducation nationale,Sciences Po Paris,"Groupe Casino, APCO Worldwide",Parti socialiste,,,,,,,
Perrine Dufoix,people,Gouvernement,Conseillère presse et communication,Éducation nationale,,,Les Républicains,,,,,,,
Isabelle Bourhis,people,Gouvernement,"Conseillère sociale, partenariats et vie scolaire",Éducation nationale,,SNPDEN-UNSA,,,,,,,,
Antoine Evennou,people,Gouvernement,Directeur adjoint du cabinet,Éducation nationale,,"Groupe Macif, MGEN, FCPE, UNL, Association Française pour les Nations Unies",,,,,,,,
Raphaël Muller,people,Gouvernement,Directeur adjoint du cabinet,Éducation nationale,"Sciences Po Paris, ENS",ESSEC,Les Républicains,,,,,,,
Christophe Kerrero,people,Gouvernement,Directeur du cabinet,Éducation nationale,Agrégé de lettres,,Les Républicains,,,,,,,
Fanny Anor,people,Gouvernement,Directrice du cabinet et conseillère spéciale,Éducation nationale,ENS,,,,,,,,,
Alexandre Dimeck-Ghione,people,Gouvernement,Conseiller chargé du suivi de l'exécution des réformes,Égalité Femmes Hommes,,Allianz,,,,A fait du bénévolat au centre LGBT du Mans,,,,
Anne Rubinstein,people,Gouvernement,Directrice de cabinet,Égalité Femmes Hommes,,La Poste,Parti socialiste,,,Judaïsme,,,,
Amandine Pasquier,people,Gouvernement,Conseillère en charge des droits des femmes,Égalité Femmes Hommes,,"État-Major des Armées, Suez",Les Républicains,,,Pas sûr pour ex-Les Républicains,,,,
Marlène Schiappa,people,Gouvernement,"Secrétaire d'État auprès du Premier ministre, chargée de l'Égalité entre les femmes et les hommes et de la Lutte contre les discriminations",Égalité Femmes Hommes,,"Yahoo!, Havas, Bondy Blog, Lagardère",Parti socialiste,,435,,,,,
Harmonie Sala,people,Gouvernement,Chef de cabinet,Égalité Femmes Hommes,Docteur en droit,Vogel & Vogel,Mouvement démocrate,,,,,,,
Stéphanie Lozano,people,Gouvernement,Chef de cabinet,Égalité Femmes Hommes,,,Parti socialiste,,,,,,,
Yenad Mlaraha,people,Gouvernement,Conseiller en charge de la lutte contre les discriminations,Égalité Femmes Hommes,,"Assemblée nationale (collaborateur de Monique Limon), France 24, RFI",,,,,,,,
