node,type,position,group,education,religion,reference
Agnès Buzyn,people,Ministre des solidarités et de la santé,Gouvernement,,"Judaïsme, Grand Orient de France",
Agnés Callou,people,"Chargée de mission, chargée des relations avec la presse",Ministère de la Justice,,,
Ahlem Gharbi,people,Conseillère technique Afrique du Nord et Moyen-Orient,Présidence,"Sciences Po, ENA",,
Alexandra Leuliette,people,Chef de cabinet,Affaires européennes,,,
Alexandre Adam,people,Conseiller technique Europe,Présidence,,,
Alexandre Brugère,people,Conseiller réforme de l'État et prospective,Action comptes publics,,,
Alexis Dutertre,people,Conseiller Europe,Premier Ministre,,,
Alexis Kohler,people,Secrétaire général de la Présidence,Présidence,"Sciences Po, ENA (promotion Averroès), ESSEC",Judaïsme,442
Alexis Zajdenweber,people,"Conseiller économie, finances, industrie",Présidence,"Sciences Po, ENA",,
Alice Rufo,people,"Conseillère Asie, Russie, Caucase, Turquie, Balkans, Réfugiés",Présidence,,,
Aloïs Kirchner,people,Conseiller Industrie,Économie,,,
Amaury Bodin,people,"Conseiller chargé de la candidature olympiques et paralympiques, des grands évènements et des grands équipements",Sports,,,
Amaury Desrivieres,people,État-Major particulier (Aide de Camp),Présidence,,,
Amaury Dumay,people,Chef de cabinet,Cohésion des Territoires,,,
Amel Kefif,people,Chef de cabinet,Égalité Femmes Hommes,,,
André Loesekrug-Pietri,people,Conseiller spécial,Ministère des armées,,,
Anne Beinier,people,Conseillère parlementaire,Santé,,,
Anne Clerc,people,Chef de Cabinet,Premier Ministre,,,
Anne de Bayser,people,Secrétaire générale adjointe,Présidence,ENA,,
Anne Rubinstein,people,Chef de Cabinet,Ministère de la transition écologique,,,
Anne-Claire Mialot,people,"Conseillère cohésion des territoires, logement",Présidence,,,
Anne-Sophie Barthez,people,Conseillère formation,Enseignement supérieur,,,
Annick Girardin,people,Ministre des outre-mer,Gouvernement,,,377
Antoine Foucher,people,Directeur de cabinet,Travail,Sciences Po,,
Antoine Pellion,people,"Conseiller énergie, environnement, transports",Présidence,Mines ParisTech,,
Antoine Saintoyant,people,"Conseiller économie, finances, industrie (chef de pôle)",Premier Ministre,"Sciences Po, ENA",,
Armando De Oliveira,people,"Général de Brigade, Conseiller Gendarmerie",Ministère de l'Intérieur,,,
Arnaud Guerry,people,État-Major particulier (Aide de Camp),Présidence,,,
Arnaud Ngatcha,people,"Conseiller communication et stratégie, partenariats, lutte contre les discriminations",Sports,,,
Arnaud Quiniou,people,"Lieutenant-colonel de sapeurs-pompiers professionnels, Conseiller sécurité civile",Ministère de l'Intérieur,,,
Aude Muscatelli,people,"Directrice adjointe de cabinet, solidarités",Santé,,,
Audrey Bourolleau,people,"Conseillère agriculture, pêche, forêt et développement rural",Présidence,,,
Aurélia Lecourtier-Gegout,people,"Conseillère budget, fonction publique, réforme de l'État (chef de pôle)",Premier Ministre,,,
Aurélia Schaff,people,Conseillère chargée de l'Europe et des relations internationales,Ministère de la Justice,,,
Aurélien Lechevallier,people,Conseiller diplomatique adjoint et sherpa G7,Présidence,ENA (promotion Léopold Sédar Senghor),,
Aymeric Chassaing,people,Conseiller communication et médias,Transport,,,
Aymeric Lang,people,Chef de cabinet,Transport,,,
Barbara Frugier,people,Conseillère communication internationale,Présidence,,,
Benjamin Gallezot,people,Directeur adjoint du cabinet civil et militaire,Ministère des armées,,,
Benjamin Griveaux,people,Porte-parole du gouvernement,Gouvernement,"Sciences Po, HEC",,
Benjamin Maurice,people,Conseiller social,Transport,,,
Benoît Faraco,people,Conseiller spécial et en charge des négociations internationales sur le climat,Ministère de la transition écologique,,,
Benoît Ribadeau-Dumas,people,Directeur de cabinet,Premier Ministre,"Polytechnique, ENA (promotion Marc Bloch)",,
Benoit Tonanny,people,Chargé de mission auprès du Conseiller Gendarmerie,Ministère de l'Intérieur,,,
Bernard Émié,people,Directeur de la DGSE,Pas au gouvernement,"ENA, Sciences Po, ENS",,
Bernard Rogel,people,Chef de l'État-major particulier,Présidence,,,
Bertrand Dumont,people,Directeur adjoint du cabinet,Économie,"ENA, ENS, Sciences Po",,
Bertrand Sirven,people,Conseiller auprès du ministre,Économie,,,
Brice Blondel,people,Directeur adjoint de cabinet,Outre-Mer,,,
Brune Poirson,people,Secrétaire d'État,Ministère de la transition écologique,,,
Bruno Gares,people,"Conseiller en charge du développement de la pratique sportive, de la formation et des établissements",Sports,,,
Bruno Le Maire,people,Ministre de l'économie et des finances,Gouvernement,"ENA, Sciences Po, ENS",,267
Bruno Roger-Petit,people,"Conseiller, porte-parole",Présidence,Sciences Po,,
Carine Lecoeur,people,Conseillère presse et communication,Ministère de la transition écologique,,,
Catherine Doumid,people,"Conseillère en charge de la communication, presse et opinion",Action comptes publics,,,
Catherine Geslain-Lanéelle,people,Directrice de cabinet,Agriculture,,,
Catherine Petit,people,Conseillère en charge des droits des femmes,Égalité Femmes Hommes,,,
Cécile Collin,people,"Conseillère en charge des questions européennes et internationales, de la francophonie et du patrimoine",Action comptes publics,,,
Cédric O,people,Conseiller technique participations et économie numérique,"Présidence, Premier Ministre",HEC,,
Chantal De Singly,people,Directrice de cabinet,Sports,,,
Charles Hufnagel,people,Conseiller communication,Premier Ministre,Sciences Po,,
Charles Sitzenstuhl,people,Conseiller politique,Économie,,,
Charles-Henri Weymuller,people,Conseiller technique macro-économie,"Présidence, Premier Ministre","Polytechnique, Science-Po",,
Charlotte Caubel,people,Conseillère justice,Premier Ministre,ENM,,
Charlotte Leroy,people,Conseillère en charge des relations avec le Parlement et les élus,Transport,,,
Charlotte Locquet,people,Conseillère technique chargée des affaires réservées et des déplacements,Action comptes publics,,,
Charlotte Mailly,people,"Conseillère technique, chef du secrétariat particulier",Premier Ministre,,,
Christophe Castaner,people,Secrétaire d'État chargé des relations avec le Parlement,"Gouvernement, Premier Ministre",,,
Christophe Kerrero,people,Directeur de cabinet,Éducation nationale,,,
Christophe Pacohil,people,Chef de Cabinet,Éducation nationale,,,
Claire Guillemain,people,"Conseillère en charge de l'action territoriale, du soutien à la création et aux artistes et des relations sociales",Culture,,,
Claire Peyron,people,Conseillère pour la communication et la presse,Agriculture,,,
Claire Scotton,people,Directeur du cabinet adjoint,Travail,,,
Claudia Ferrazzi,people,Conseillère culture et communication,Présidence,,,
Clémence Lecœur,people,"Chef de cabinet, conseillère auprès du secrétaire d'État",Relations avec le Parlement,,,
Clément Beaune,people,Conseiller Europe et G20,Présidence,ENA,,
Clothilde Fretin-Brunet,people,"Conseillère stratégie et gouvernance des territoires, contractualisation, péréquation, métropoles et Grand Paris",Cohésion des Territoires,,,
Côme Berbain,people,"Pôle budget, fonction publique, réforme de l'État",Numérique,,,
Constance Bensussan,people,"Conseillère technique inclusion, égalité femmes hommes et citoyenneté","Présidence, Premier Ministre","Sciences Po, ENA",Judaïsme,
Corinne Desforges,people,Directrice de cabinet,Égalité Femmes Hommes,,,
Cyril Mourin,people,"Conseiller sport, JO 2024, engagement associatif",Présidence,,,
Damien Caze,people,"Conseiller écologie, transports, énergie, logement et agriculture (chef de pôle)",Premier Ministre,,,
David Cavaillolès,people,"Conseiller budgétaire, industrie et spatial",Enseignement supérieur,,,
David Knecht,people,Conseiller budgétaire et numérique,Éducation nationale,,,
Davy Liger,people,Conseiller affaires sanitaires,Agriculture,,,
Délphine Semavoine,people,Chef de cabinet adjointe,Ministère de la Justice,,,
Denis Voisin,people,"Conseiller en charge de la société civile, des questions de santé-environnement et des risques",Ministère de la transition écologique,,,
Diane Simiu,people,Conseillère technique écologie,"Présidence, Premier Ministre",Polytechnique,,
Dimitri Grygowski,people,Directeur adjoint de cabinet,Sports,,,
Dimitri Lucas,people,Conseiller Presse,Économie,,,
Dimitri Zoulas,people,"Commissaire divisionnaire, chargé de mission auprès du conseiller police",Ministère de l'Intérieur,,,
Dominique Consille,people,"Conseillère ruralité, villes moyennes, accès aux services et revitalisation",Cohésion des Territoires,,,
Dominique Sorain,people,Directeur de cabinet,Outre-Mer,,,
Eddie Aït,people,Conseiller spécial,Outre-Mer,,Judaïsme,
Édouard Geffray,people,Directeur de cabinet,Ministère de la Justice,,,
Édouard Philippe,people,Premier Ministre,Premier Ministre,ENA (promotion Marc Bloch),,
Édouard Solier,people,"Conseiller technique, discours",Premier Ministre,,,
Eléonore Peyrat,people,Conseillère affaires européennes et internationales,Économie,,,
Elisabeth Borne,people,Ministre chargée des transports,Gouvernement,,,428
Emmanuel Bonne,people,Directeur de cabinet,Ministère des Affaires étrangères,,,
Emmanuel Lenain,people,Conseiller diplomatique (chef de pôle),Premier Ministre,,,
Emmanuel Macron,people,Président de la République,Présidence,ENA (promotion Léopold Sédar Senghor),,
Emmanuel Miquel,people,"Conseiller entreprise, attractivité et export",Présidence,"HEC, Sciences Po",,
Emmanuel Monnet,people,Conseiller au financement de l'économie,Économie,,,
Emmanuel Moulin,people,Directeur du cabinet,Économie,"ENA, ESSEC",,
Eric Cayol,people,"chef de cabinet, chargé des relations avec les parlementaires",Outre-Mer,,,
Eric Jalon,people,Conseiller affaires intérieures (Chef de pôle),Premier Ministre,"ENA (promotion Valmy), ENS",,
Erwan Quinio,people,"Conseiller veille, prospective et société civile",Affaires européennes,,,
Étienne de Gonneville,people,Conseiller affaires stratégiques,Présidence,,,
Etienne Ranaivoson,people,Conseiller technique affaires européennes,Premier Ministre,,,
Eve Zuckerman,people,Conseillère technique communication digitale,Premier Ministre,,Judaïsme,
Fabien Mandon,people,État-major particulier,Présidence,,,
Fabrice Aubert,people,"Conseiller institutions, action publique et transition numérique",Présidence,,,
Fanny Anor,people,Conseillère spéciale,Éducation nationale,,,
Fanny Forrest-Baccialone,people,Conseillère parlementaire,Travail,,,
Fanny Le Luel,people,Conseillère parlementaire (chef de pôle),Premier Ministre,,,
Florence Parly,people,Ministre des armées,Gouvernement,,,
Floriant Colas,people,Conseiller,Action comptes publics,,,
Francis Decoux,people,Conseiller technique relations avec les élus,Premier Ministre,,,
Franck Morel,people,"Conseiller relations sociales, travail, emploi, formation professionnelle",Premier Ministre,"ENA, HEC",,
Franck Paris,people,Conseiller Afrique,Présidence,ENA (promotion Léopold Sédar Senghor),,
Franck Von Lennep,people,"Conseiller santé, protection sociale, politiques sociales (chef de pôle)",Premier Ministre,,,
François Charmont,people,Directeur de cabinet,Relations avec le Parlement,,,
François Lecointre,people,Chef du cabinet militaire,Premier Ministre,,,
François-Xavier Blin,people,État-Major particulier,Présidence,,,
François-Xavier Lauch,people,Chef de cabinet,Présidence,,,
Françoise Nyssen,people,Ministre de la culture,Gouvernement,,Société anthroposophique universelle,
Frédéric Jung,people,Conseiller diplomatique,Ministère de l'Intérieur,,,
Frédéric Michel,people,"Conseiller pêche, conseiller diplomatique",Agriculture,,,
Frédéric Parisot,people,État-Major particulier,Présidence,,,
Frédérique Camilleri,people,Chef du Cabinet civil,Ministère des armées,,,
Frédérique Gerardin,people,"Conseillère en charge des questions européennes et internationales, de la francophonie et du patrimoine",Culture,,,
Frédérique Vidal,people,"Ministre de l'enseignement supérieur, de la recherche et de l'innovation",Gouvernement,,,
Gaël Hamayon,people,Conseiller en charge de la communication et des relations avec la presse,Culture,,,
Gaël Veyssiere,people,Directeur de cabinet,Affaires européennes,,,
Gaëlle Nerbard,people,"Conseillère chargée des affaires sociales, du travail, de l'emploi, de la santé et de la jeunesse ;",Outre-Mer,,,
Garance Pineau,people,Conseillère diplomatique,Travail,,,
Geneviève Darrieussecq,people,Secrétaire d'État,Ministère des armées,,,
Gérald Darmanin,people,Ministre de l'action et des comptes publics,Gouvernement,,,420
Gérard Collomb,people,Ministre de l'intérieur,Gouvernement,,Grand Orient de France,
Gilles de Margerie,people,Directeur du cabinet,Santé,"ENS, ENA",,
Gilles Lara-Adelaide,people,Conseiller budgétaire et social,Ministère des armées,,,
Graig Monetti,people,Conseiller vie étudiante,Enseignement supérieur,,,
Grégoire Demezon,people,Chargé de mission auprès du Conseiller Gendarmerie,Ministère de l'Intérieur,,,
Grégoire Devaux,people,Conseiller pour la communication,Ministère des armées,,,
Grégory-Hugues Frély,people,Conseiller technique sécurité intérieure,Premier Ministre,,,
Guillaume Couillard,people,Conseiller technique santé,Premier Ministre,,,
Guillaume Macher,people,Chef de cabinet,Sports,,,
Guillaume Rauffet,people,Conseiller,Action comptes publics,,,
Hanane Boutayeb,people,Conseillère enseignement agricole et recherche,Agriculture,,,
Hélène Brisset,people,Directrice de cabinet,Numérique,,,
Henri Soupa,people,"Conseiller chargé de la communication, de la presse et de la culture",Outre-Mer,,,
Hervé Grandjean,people,Conseiller pour les affaires industrielles,Ministère des armées,,,
Isabelle Bourhis,people,"Conseillère sociale, partenariats et vie scolaire",Éducation nationale,,,
Isabelle Jourdan,people,Conseillère chargée de la communication et des médias,Santé,,,
Isabelle Le Goff,people,"Commandant divisionnaire à l'emploi fonctionnel, chargée de mission auprès du conseiller police.",Ministère de l'Intérieur,,,
Isabelle Richard,people,Conseillère Santé,Enseignement supérieur,,,
Ismaël Emelien,people,Conseiller spécial,Présidence,,,
Jacqueline Gourault,people,Ministre auprès du ministre de l'Intérieur,Gouvernement,,,
Jacques Mezard,people,Ministre de la cohésion des territoires,Cohésion des Territoires,,,
Jacques Mézard,people,Ministre de la cohésion des territoires,Gouvernement,,,
Jacques-Oliver Dauberton,people,Conseiller chargé de la sécurité sanitaire,Santé,,,
Jay Dharmadhikari,people,"Conseiller affaires globales, développement et Afrique",Ministère des Affaires étrangères,,,
Jean Casabianca,people,Chef du cabinet militaire,Ministère des armées,,,
Jean-Baptiste Lemoyne,people,Secrétaire d'État,Ministère des Affaires étrangères,,,
Jean-Baptiste Minato,people,Conseiller technique budget,Premier Ministre,,,
Jean-Benoît Albertini,people,Directeur de cabinet,Cohésion des Territoires,,,
Jean-Christophe Le Minh,people,Chef de cabinet,Ministère des Affaires étrangères,,,
Jean-Christophe Perrochon,people,État-Major particulier,Présidence,,,
Jean-Claude Mallet,people,Conseiller spécial du ministre,Ministère des Affaires étrangères,,,
Jean-Emmanuel Vachat,people,"Commandant, chargé de mission auprès du conseiller police",Ministère de l'Intérieur,,,
Jean-Marie Girier,people,Chef de Cabinet,Ministère de l'Intérieur,,,
Jean-Michel Blanquer,people,Ministre de l'éducation nationale,Gouvernement,,,365
Jean-Miguel Pire,people,"Conseiller en charge de l'accès à la culture, de l'enseignement artistique, du livre et de la lecture",Culture,,,
Jean-Philippe Bourgoin,people,Conseiller recherche,Enseignement supérieur,,,
Jean-Yves Le Drian,people,Ministre de l'Europe et des affaires étrangères,Gouvernement,,Grand Orient de France,
Jeanne Guesdon,people,Chef-adjointe de cabinet,Culture,,,
Jennifer Bierna,people,Conseillère presse et communication,Relations avec le Parlement,,,
Jennifer Moreau,people,Conseillère technique politiques de développement et climat,Présidence,,,
Jérôme Fournel,people,Directeur du Cabinet,Action comptes publics,,,
Jérôme Theiller,people,État-Major particulier,Présidence,,,
Jimmy Brun,people,Conseiller technique transports,"Présidence, Premier Ministre",,,
Jonathan Nussbaumer,people,"Conseiller technique industrie, commerce et artisanat","Présidence, Premier Ministre","Polytechnique, Mines ParisTech",,
Julie Lavet,people,Chef de cabinet,Agriculture,,,
Julien Blanc,people,"Conseiller collectivités territoriales, Europe et international",Enseignement supérieur,,,
Julien Dehornoy,people,Directeur adjoint du cabinet,Transport,,,
Julien Denormandie,people,Secrétaire d'État,Cohésion des Territoires,,,
Julien Turenne,people,Conseiller technique agriculture,Premier Ministre,,,
Justine Coutard,people,Directrice adjointe du cabinet,Action comptes publics,,,
Justine Roulot,people,"Conseillère en charge de la biodiversité, de l'eau, de la mer et des territoires",Ministère de la transition écologique,,,
Karen Martinon,people,"Chef de cabinet, chargée de la communication et des relations avec les parlementaires",Handicapés,,,
Koumaran Pajaniradja,people,"Conseiller construction, urbanisme, habitat et transition énergétique",Cohésion des Territoires,,,
Laura Flessel,people,Ministre des sports,Gouvernement,,,
Laurence Tison-Vuillaume,people,Directrice-adjointe du cabinet,Culture,,,
Laurent Grave-Raulin,people,Conseiller parlementaire et relations avec les élus,Ministère de la transition écologique,,,
Laurent Habert,people,Conseiller budgétaire et finances sociales,Santé,,,
Laurent Hottiaux,people,"Conseiller intérieur, sécurité",Présidence,,,
Laurent Martel,people,Conseiller fiscalité et prélèvements obligatoires (adjoint au chef de pôle),"Présidence, Premier Ministre",,,
Laurent Naves,people,Conseiller politique et parlementaire,Ministère des Affaires étrangères,,,
Laurent Vercruysse,people,Directeur adjoint du cabinet,Action comptes publics,,,
Layla Rahhou,people,Chef de cabinet chargée de la communication et du Parlement,Numérique,,,
Lionel Collet,people,Conseiller spécial,Santé,,,
Loïc Turpin,people,Chef de cabinet,Culture,,,
Luis Vassy,people,Directeur-adjoint de cabinet,Ministère des Affaires étrangères,,,
Marc Chappuis,people,Directeur du cabinet adjoint en charge du pôle territoires,Cohésion des Territoires,,,
Marc Ferracci,people,Conseiller spécial auprès de la ministre,Travail,,,
Marc Papinutti,people,Directeur de cabinet,Transport,,,
Marc Schwartz,people,Directeur de cabinet,Culture,,,
Margaux Bergeon-Dars,people,"Conseillère Nations unies et organisations internationales, affaires juridiques et consulaires",Ministère des Affaires étrangères,"ENS, Sciences Po",,
Marguerite Cazeneuve,people,Conseillère technique protection sociale et comptes sociaux,"Présidence, Premier Ministre",HEC,,
Marie Audouard,people,"Conseillère technique Afrique, relations bilatérales",Présidence,,,
Marie Dutertre,people,Conseillère parlementaire,Éducation nationale,,,
Marie Fontanel,people,Conseillère solidarités et santé,Présidence,ENA (promotion Léopold Sédar Senghor),,
Marie Francolin,people,Conseillère communication et presse,Enseignement supérieur,,,
Marie Reynier,people,"Conseillère éducation, enseignement supérieur, jeunesse et sports (chef de pôle)",Premier Ministre,,,
Marina Picon,people,"Conseillère technique, discours",Premier Ministre,,,
Marlène Schiappa,people,Chargée de l'égalité entre les femmes et les hommes,Gouvernement,,,
Martin Briens,people,Directeur du cabinet civil et militaire,Ministère des armées,ENA,,
Matthieu Lahaye,people,"Conseiller discours, mémoire, culture, langues régionales",Éducation nationale,,,
Matthieu Lefevre,people,Conseiller en charge des relations avec le Parlement,Action comptes publics,,,
Matthieu Maucort,people,Directeur de cabinet adjoint et conseiller économie numérique,Numérique,,,
Matthieu Pontecaille,people,Conseiller pour la communication et la presse,Égalité Femmes Hommes,,,
Mélanie Branco,people,Conseillère presse,Sports,,,
Mélanie Villier,people,Conseillère technique collectivités territoriales et aménagement du territoire,Premier Ministre,,,
Michèle Pappalardo,people,Directrice de cabinet,Ministère de la transition écologique,,,
Mohamed Hamrouni,people,Chef adjoint de cabinet,Premier Ministre,,Islam,
Morgan Larhant,people,"Conseiller questions financières, budgétaires et économiques",Affaires européennes,,,
Mounir Mahjoubi,people,Secrétaire d'État chargé du numérique,Premier Ministre,,Islam,
Muriel Pénicaud,people,Ministre du travail,Gouvernement,,,368
Myriam Pavageau,people,"Conseillère affaires stratégiques, Asie, Europe continentale",Ministère des Affaires étrangères,,,
Nathalie Cantan,people,Conseillère diplomatique adjointe,Ministère des armées,,,
Nathalie Loiseau,people,Ministre chargée des Affaires européennes,Gouvernement,,,
Nathanaël Mason-Schuler,people,Conseiller technique financement de l'économie et investissements,Premier Ministre,"Sciences Po, ENA",,
Nicolas Castoldi,people,Directeur adjoint du cabinet,Enseignement supérieur,,,
Nicolas Heitz,people,Conseiller chargé de la coordination des politiques de la justice,Ministère de la Justice,,,
Nicolas Hulot,people,Ministre de la transition écologique et solidaire,Gouvernement,,Grand Orient de France,
Nicolas Jegou,people,Conseiller technique Europe,Présidence,"ENA, Polytechnique",,
Nicolas Labrune,people,Conseiller,Santé,,,
Nicolas Lerner,people,Directeur-adjoint du cabinet,Ministère de l'Intérieur,ENA (promotion Léopold Sédar Senghor),,
Nicolas Pernot,people,Conseiller spécial,Ministère de la Justice,,,
Nicole Belloubet,people,"Garde des sceaux, ministre de la justice",Gouvernement,,,
Nolwenn Chouffot,people,Chargée de mission auprès des conseillers pour les affaires intérieures,Premier Ministre,,,
Olivier Courson,people,"Conseiller culture, communication, régulation numérique (chef de pôle)",Premier Ministre,,,
Olivier Decottignies,people,"Conseiller Afrique du Nord, Moyen-Orient, Amériques",Ministère des Affaires étrangères,,,
Olivier Gerstlé,people,Directeur de cabinet (partie porte-parole),Relations avec le Parlement,,,
Pascal Confavreux,people,Conseiller technique diplomatie économique,Premier Ministre,,,
Patrice Fondin,people,"Conseiller éducation, formation et enseignement supérieur",Handicapés,,,
Patrice Ivon,people,Conseiller en charge des mutations économiques et de la santé au travail,Travail,,,
Patrick Stzroda,people,Directeur de cabinet,Présidence,ENA,,
Perrine Dufoix,people,Conseillère presse et communication,Éducation nationale,,,
Philippe Étienne,people,Conseiller diplomatique,Présidence,"ENA, ENS",,
Philippine Laniesse,people,Conseillère communication et presse,Affaires européennes,,,
Phillippe Baptiste,people,Directeur du cabinet,Enseignement supérieur,,,
Pierre Dantin,people,"Conseiller spécial chargé de la candidature olympiques et paralympiques, du sport et de la santé, du sport de haut niveau et du sport professionnel",Sports,,,
Pierre Regnault de La Mothe,people,Conseiller technique affaires intérieures,Premier Ministre,,,
Pierre Schill,people,État-Major particulier,Présidence,,,
Pierre-André Imbert,people,Conseiller Social,Présidence,,,
Pierre-Emmanuel Lecerf,people,"Conseiller en charge du numérique, des industries culturelles et des médias",Culture,,,
Pierre-Emmanuel Portheret,people,Chef de Cabinet,Ministère de la Justice,,,
Quentin Lafay,people,Conseiller Prospective,Présidence,,,
Raphaël Muller,people,Directeur adjoint du cabinet,Éducation nationale,,,
Rebecca Peres,people,Conseillère parlementaire,Présidence,,,
Rémi Bastille,people,"Conseiller chargé des affaires régaliennes, institutionnelles et de la sécurité ;",Outre-Mer,,,
Rodrigue Furcy,people,Chef de Cabinet adjoint,Présidence,,,
Samuel Degarra,people,"Directeur adjoint de cabinet, conseiller politique et parlementaire",Agriculture,,,
Sarah Gallitre,people,Conseillère en charge de la prospective et des discours,Culture,,,
Sébastien Becoulet,people,"Conseiller politiques sociales du logement, ville, renouvellement urbain durable, hébergement et inclusion",Cohésion des Territoires,,,
Sébastien Eugène,people,"Conseiller chargé des affaires économiques, des entreprises, de la fiscalité et des questions budgétaires.",Outre-Mer,,,
Sébastien Lecornu,people,Secrétaire d'État,Ministère de la transition écologique,,,
Serge Lhermitte,people,Conseiller filières et entreprises,Agriculture,,,
Sibeth Ndiayes,people,Conseillère presse et communication,Présidence,,,
Simon Fetet,people,"Donseiller budgétaire, modernisation et administration territoriale",Ministère de l'Intérieur,,,
Sonya Djemni-Wagner,people,Conseillère Justice,Présidence,,,
Sophie Cluzel,people,Secrétaire d'État chargée des personnes handicapées,Premier Ministre,,,
Sophie Dulibeau,people,Conseillère presse et communication,Ministère de l'Intérieur,,,
Sophie Ferracci,people,Chef de cabinet,Santé,,,
Sophie Lagoutte,people,Directrice-adjointe de cabinet,Affaires européennes,,,
Soria Blatmann,people,"Conseillère technique droits humains, francophonie, rayonnement culturel, société civile",Présidence,,,
Stanislas Cazelles,people,Conseiller outre-mer,Présidence,ENA (promotion Léopold Sédar Senghor),,
