node,type,area,position,group,education,employer,political party,religion,reference,comments,membership,,
Alain Triolle,people,Gouvernement,"Directeur du cabinet, directeur adjoint du cabinet",Action comptes publics,ENA,,,,,,,,
Alexandre Brugère,people,Gouvernement,Conseiller réforme de l'État et prospective,Action comptes publics,,Eurogroup Consulting,Les Républicains,,,,,,
Caroline Krykwinski,people,Gouvernement,Directrice adjointe du cabinet,Action comptes publics,ENA,Cour des comptes,,,,,,,
Cécile Collin,people,Gouvernement,"Chef de cabinet, conseillère auprès du ministre",Action comptes publics,,"Havas, CSC",Les Républicains,,,,,,
Charlotte Locquet,people,Gouvernement,Conseillère technique chargée des affaires réservées et des déplacements,Action comptes publics,,,Les Républicains,,,,,,
Christophe Guérin-Linxe,people,Gouvernement,"Chef de cabinet, conseiller en charge des relations avec le Parlement, de la communication et de la presse",Action comptes publics,,,Parti socialiste,,,,,,
Florian Colas,people,Gouvernement,Conseiller,Action comptes publics,"Sciences Po Paris, ENA (promotion Marie Curie)","Wendel, Inspection Générale des Finances, Astrium, Lafarge, Lehman Brothers",,,,,,,
Gérald Darmanin,people,Gouvernement,Ministre de l'action et des comptes publics,Action comptes publics,,,Les Républicains,,420,Judaïsme,,,
Guillaume Rauffet,people,Gouvernement,Conseiller,Action comptes publics,ENA,,,,,,,,
Jérôme Fournel,people,Gouvernement,Directeur du Cabinet,Action comptes publics,"ENA, HEC",FMI,Les Républicains,,,,,,
Justine Coutard,people,Gouvernement,Directrice du cabinet,Action comptes publics,"Sciences Po Paris, ENA","Groupe ADP, Inspection des finances",,,,,,,
Manon Perrière,people,Gouvernement,Conseillère juridique,Action comptes publics,"Sciences Po Paris, ENS, ENA",,,,,,,,
Mathieu Lefevre,people,Gouvernement,Conseiller en charge des relations avec le Parlement,Action comptes publics,,,Les Républicains,,,,,,
Olivier Dussopt,people,Gouvernement,Secrétaire d’État auprès du ministre de l’Action et des Comptes publics,Action comptes publics,,,Parti socialiste,,,Grand Orient de France (pas sûr pour le GODF),Intergroupe de la LICRA,,
Pauline Hodille,people,Gouvernement,Conseillère en charge des comptes sociaux,Action comptes publics,,,,,,,,,
Pierre-Jean Le Mauff,people,Gouvernement,"Conseiller en charge de la communication, presse et opinion",Action comptes publics,,"Taddeo, Tilder, IFOP, RFF",,,,,,,
Renan Megy,people,Gouvernement,Conseiller finances locales et fonction publique territoriale,Action comptes publics,,"Chambre régionale des comptes, Métropole Européenne de Lille, Grand Lyon, communauté urbaine",,,,,,,
Anne Boillon,people,Gouvernement,Directrice de cabinet,Affaires étrangères,ENS,,Parti socialiste,,,,,,
Arnaud Jayet,people,Gouvernement,Chef de cabinet,Affaires étrangères,,,Les Républicains,,,,,,
Baptiste Prudhomme,people,Gouvernement,Conseiller politique et parlementaire,Affaires étrangères,,,Parti socialiste,,,,,,
Charlotte Baratin,people,Gouvernement,"Conseillère questions financières, budgétaires, économiques, agricoles et outre-mer",Affaires étrangères,"ENA (promotion Jean de la Fontaine), ENS","TheFamily, La Banque Postale, Parlement européen",,,,,,,
Constance Jacquin,people,Gouvernement,"Conseillère auprès du ministre en charge des Relations avec le Parlement et les Élus, du Développement et de la Solidarité internationale",Affaires étrangères,,,Les Républicains,,,,,,
Fanny Demassieux,people,Gouvernement,Chef du cabinet,Affaires étrangères,,"UNEP, Agence Française de Développement",Parti socialiste,,,,,,
Gaëtan Bruel,people,Gouvernement,"Conseiller diplomatie culturelle, influence et francophonie",Affaires étrangères,"ENS, EHESS","Centre des monuments nationaux, Grasset",Parti socialiste,,,Judaïsme,,,
Jean-Baptiste Lemoyne,people,Gouvernement,Secrétaire d'État auprès du ministre de l'Europe et des Affaires étrangères,Affaires étrangères,ESSEC,IBM Global Services,Les Républicains,,458,,,,
Jean-Claude Mallet,people,Gouvernement,Conseiller spécial du ministre,Affaires étrangères,ENA (promotion Léonard de Vinci),,Parti socialiste,,,,,,
Jean-Yves Le Drian,people,Gouvernement,Ministre de l'Europe et des affaires étrangères,Affaires étrangères,,,Parti socialiste,,347,Grand Orient de France,,,
Jérémie Robert,people,Gouvernement,"Conseiller Afrique, développement",Affaires étrangères,,,,,,,,,
Luis Vassy,people,Gouvernement,Directeur adjoint de cabinet,Affaires étrangères,"ENA, Sciences Po Paris",,Parti socialiste,,415,,,,
Margaux Bergeon-Dars,people,Gouvernement,"Conseillère Europe continentale, Nations unies et organisations internationales, affaires juridiques et consulaires",Affaires étrangères,"ENS, Sciences Po Paris",,,,,Parle l'hébreux... (c'est indiqué sur son profil LinkedIn),,,
Myriam Pavageau,people,Gouvernement,"Conseillère affaires stratégiques, Asie",Affaires étrangères,Sciences Po Paris,,,,,,,,
Nathalie Fortis,people,Gouvernement,Conseillère en charge de la communication et des relations avec la presse,Affaires étrangères,,,,,,,,,
Nicolas Roche,people,Gouvernement,Directeur de cabinet du ministre,Affaires étrangères,,,,,,,,,
Olivier Decottignies,people,Gouvernement,"Conseiller Afrique du Nord, Moyen-Orient",Affaires étrangères,"ENS, Sciences Po Paris, EHESS",,,,,,,,
Véronique Le Goff,people,Gouvernement,Conseillère communication et presse,Affaires étrangères,,"Havas, Groupama",Parti socialiste,,,,,,
Amélie de Montchalin,people,Gouvernement,"Secrétaire d'Etat auprès du ministre de l'Europe et des Affaires étrangères, chargée des Affaires européennes",Affaires européennes,"HEC, Harvard Kennedy School of Government","BNP Paribas, Axa",Les Républicains,,,Young Leader 2018,Intergroupe de la LICRA,Essonne,Ile-de-France
Antonin Ferri,people,Gouvernement,"Conseiller marché intérieur, développement durable et politiques sociales",Affaires européennes,"Mines ParisTech, MIT, ENS",Commission européenne,,,,,,,
Boris Melmoux-Eude,people,Gouvernement,Directeur adjoint de cabinet,Affaires européennes,"ENA, Sciences Po Paris","Haute Autorité de transparence de la vie publique, Cour des comptes",,,,,,,
Camille Angué,people,Gouvernement,"Cconseillère, chef de cabinet",Affaires européennes,HEC,,,,,,,,
Christophe Parisot,people,Gouvernement,Directeur adjoint de cabinet et conseiller chargé des affaires européennes,Affaires européennes,,,,,,,,,
Matthieu Ellerbach,people,Gouvernement,"Conseiller presse, communication et relations avec la société civile",Affaires européennes,Sciences Po Paris,Brunswick Group,Les Républicains,,,,,,
Niels Gaubert,people,Gouvernement,"Conseiller spécial, communication et presse, en charge des relations avec le Parlement",Affaires européennes,Sciences Po Paris,"Havas, Cour des comptes",Les Républicains,,,,,,
Thomas Hartog,people,Gouvernement,Conseiller parlementaire,Affaires européennes,,Vae Solis Corporate,Parti socialiste,,,Judaïsme,,,
Vincent Guérend,people,Gouvernement,Directeur de cabinet,Affaires européennes,"ENA (promotion Marc Bloch), Sciences Po Paris",Commission européenne,,,,,,,
Anne Bronner,people,Gouvernement,"Conseillère en charge de la qualité, de la sécurité et de la performance sanitaires de l'alimentation, du bien-être animal et de la lutte contre la maltraitance animale",Agriculture,,,,,,,,,
Béatrice Frécenon,people,Gouvernement,"Directrice adjointe de cabinet, conseillère stratégie et politique, en charge des relations diplomatiques",Agriculture,,,Parti socialiste,,,,,,
Bénédicte Bergeaud,people,Gouvernement,Conseillère en charge des relations avec le Parlement,Agriculture,,Anthenor Public Affairs,,,,,,,
Benoît Bonaimé,people,Gouvernement,"Conseiller en charge de l'enseignement agricole, technique et supérieur, de la recherche, de l'innovation et des relations sociales",Agriculture,,,,,,,,,
Didier Guillaume,people,Gouvernement,Ministre de l'agriculture et de l'alimentation,Agriculture,,,Parti socialiste,,,,,,
Guillaume Macher,people,Gouvernement,"Chef de cabinet, conseiller spécial",Agriculture,,,Parti socialiste,,,,,,
Isabelle Chmitelin,people,Gouvernement,Directrice de cabinet,Agriculture,,,,,,,,,
Mathias Ginet,people,Gouvernement,"Conseiller politique agricole commune 2014-2020, filières végétales, climat et biodiversité",Agriculture,"Sciences Po Paris, ENS, ENA (promotion Jean Zay)","Air Liquide, OMC, Alternatives Economiques",,,,,,,
Nathalie Barbe,people,Gouvernement,"Conseillère en charge des filières animales, de la forêt et de la performance économique des entreprises agricoles et agroalimentaires ",Agriculture,,,,,,,,,
Olivier Alleman,people,Gouvernement,Conseiller presse et communication,Agriculture,,"France Télévision, Europe 1",,,,,,,
Thomas Roche,people,Gouvernement,"Conseiller en charge de la pêche, de l'outre-mer et du financement de l'agriculture",Agriculture,,,,,,,,,
Adrien Bayle,people,Gouvernement,Conseiller finances locales,Cohésion des Territoires,"Sciences Po Paris, ENA, HEC",,,,,,,,
Agnès Callou,people,Gouvernement,Conseillère presse et communication,Cohésion des Territoires,,,Mouvement démocrate,,,,,,
Anne-Caroline Berthet,people,Gouvernement,Chef de Cabinet,Cohésion des Territoires,,,Union des démocrates et indépendants,,,,,,
Bastien Mérot,people,Gouvernement,Conseiller collectivités et institutions locales,Cohésion des Territoires,,,,,,,,,
David Philot,people,Gouvernement,Directeur du cabinet,Cohésion des Territoires,ENA (promotion Copernic),,"Les Républicains, Parti socialiste",,,,,,
Guillaume Rivalland,people,Gouvernement,"Chef de cabinet, conseiller affaires réservées",Cohésion des Territoires,,,Les Républicains,,,,,,
Jacqueline Gourault,people,Gouvernement,Ministre de la Cohésion des territoires et des Relations avec les collectivités territoriales,Cohésion des Territoires,,,Mouvement démocrate,,,,,,
Jérôme Masclaux,people,Gouvernement,"Directeur adjoint du cabinet et conseiller ville, urbanisme et logement",Cohésion des Territoires,Polytechnique,Mairie de Paris,Parti socialiste,,,,,,
Julie Lavet,people,Gouvernement,Conseillère spéciale,Cohésion des Territoires,,,Parti socialiste,,,,,,
Julien Denormandie,people,Gouvernement,"Ministre auprès de la ministre de la Cohésion des territoires et des Relations avec les collectivités territoriales, chargé de la Ville et du Logement",Cohésion des Territoires,,,Parti socialiste,,437,Homosexuel,,,
Juliette Part,people,Gouvernement,Conseillère aménagement du territoire,Cohésion des Territoires,"Sciences Po Paris, ENA",,,,,,,,
Koumaran Pajaniradja,people,Gouvernement,"Conseiller aménagement, construction, urbanisme et transition énergétique",Cohésion des Territoires,,Météo-France,,,,,,,
Laetitia Cesari-Giordani,people,Gouvernement,Conseillère financière et budgétaire,Cohésion des Territoires,ENA,"Direction du Budget, Cour des comptes",,,,,,,
Léa Roussarie,people,Gouvernement,Conseillère parlementaire et relations avec les élus,Cohésion des Territoires,,"Comfluence, Boury Tallon & Associés, BNP Paribas",Union des démocrates et indépendants,,,,,,
Marc Chappuis,people,Gouvernement,Directeur adjoint du cabinet,Cohésion des Territoires,Sciences Po Paris,,,,,,,,
Martin Guespereau,people,Gouvernement,Directeur adjoint du cabinet,Cohésion des Territoires,"Polytechnique, MIT",,Les Républicains,,,,,,
Olivier Bouchery,people,Gouvernement,"Conseiller spécial, politiques publiques territoriales, outre-mer",Cohésion des Territoires,Sciences Po Paris,"L'Oréal, EADS",Les Républicains,,,,,,
Pauline Malet,people,Gouvernement,Conseillère collectivités et institutions locales,Cohésion des Territoires,,,Parti socialiste,,,,,,
Philippe Court,people,Gouvernement,Directeur de cabinet,Cohésion des Territoires,Polytechnique,,Les Républicains,,,,,,
Rachel Chane-See-Chu,people,Gouvernement,Conseillère logement et politiques sociales du logement,Cohésion des Territoires,,SNCF,,,,,,,
Renaud Duplay,people,Gouvernement,Directeur du cabinet,Cohésion des Territoires,ENS,"Direction du Budget, FMI, Eurazeo",,,,,,,
Sébastien Bécoulet,people,Gouvernement,Conseiller politique de la ville et hébergement d'urgence,Cohésion des Territoires,ENA,,,,,,,,
Sébastien Lecornu,people,Gouvernement,"Ministre auprès de la ministre de la Cohésion des territoires et des Relations avec les collectivités territoriales, chargé des Collectivités territoriales",Cohésion des Territoires,ENA,Gendarmerie Nationale,Les Républicains,,413,,,,
Ségolène Redon,people,Gouvernement,Conseillère presse et communication,Cohésion des Territoires,,Havas,,,,,,,
Soraya Hamrioui,people,Gouvernement,"Conseillère budgétaire, finances",Cohésion des Territoires,,,Parti socialiste,,,Pas sûr pour la photo...,,,
Victor Schmidt,people,Gouvernement,Chef de cabinet,Cohésion des Territoires,,,Parti socialiste,,445,,,,
Ziad Gebran,people,Gouvernement,Conseiller presse et communication,Cohésion des Territoires,,,,,,,,,
Déborah Münzer,people,Gouvernement,"Conseillère en charge de l’action territoriale, de l’éducation artistique et culturelle, de l’enseignement supérieur et de la recherche",Culture,ESSEC,"Mairie de Paris, BAC Films, Assouline Publishing",Les Républicains,,429,Judaïsme,,,
Delphine Aboulker,people,Gouvernement,Conseillère en charge du patrimoine et de l'architecture,Culture,,,,,442,Judaïsme,,,
Franck Riester,people,Gouvernement,Ministre de la culture,Culture,,"EY, Peugeot",Union des démocrates et indépendants,,458,Homosexuel,,,
Leïla Derouich,people,Gouvernement,Conseillère en charge des médias et des industries culturelles,Culture,ENA (promotion Jean-Jacques Rousseau),CSA,,,,,,,
Lucie Muniesa,people,Gouvernement,Directrice du cabinet,Culture,,"Radio France, Agence des participations de l'Etat",Parti socialiste,,458,,,,
Ludovic Guillot,people,Gouvernement,"Conseiller en charge de la communication, des relations avec la presse et des relations institutionnelles",Culture,,,Les Républicains,,,,,,
Matthias Grolier,people,Gouvernement,"Conseiller en charge des affaires internationales, de la langue française et de la francophonie, du livre et de la lecture",Culture,HEC,"Gide Loyrette Nouel, Jones Day, Morgan, Lewis & Bockius",,,,,,,
Quentin Bataillon,people,Gouvernement,Conseiller parlementaire,Culture,,,Les Républicains,,,,,,
Simon Garcia,people,Gouvernement,"Conseiller en charge de la transformation du ministère, du budget et de la fiscalité",Culture,ENA,,,,,,,,
Thomas Velter,people,Gouvernement,"Chef de cabinet, conseiller auprès du ministre",Culture,,Havas,Les Républicains,,,,,,
Agnès Pannier-Runacher,people,Gouvernement,Secrétaire d’État auprès du ministre de l’Économie et des Finances,Économie,"Sciences Po Paris, ENA, HEC","Bourbon, Fonds Stratégique d'Investissement, Caisse des dépôts, Crédit Agricole",,,,,,,
Aigline de Ginestous,people,Gouvernement,"Conseillère territoires et Parlement, chef de cabinet",Économie,,"Rothschild, Lehman Brothers, Société Générale, Airbus",,,,,,,
Aloïs Kirchner,people,Gouvernement,Directeur du cabinet,Économie,"Polytechnique, Corps des mines","Inspection des finances, ESL & Network",,,,,,,
Bertrand Sirven,people,Gouvernement,Directeur adjoint du cabinet,Économie,Sciences Po Paris,"Havas, Nestlé",Les Républicains,,,,,,
Bruno Le Maire,people,Gouvernement,Ministre de l'économie et des finances,Économie,"Sciences Po Paris, ENA (promotion Valmy), ENS",,Les Républicains,,267,,,,
Charles Sitzenstuhl,people,Gouvernement,Conseiller politique,Économie,Sciences Po Paris,,,,,,,,
Dimitri Lucas,people,Gouvernement,Conseiller presse et communication,Économie,,,Les Républicains,,,,,,
Emmanuel Monnet,people,Gouvernement,Conseiller financement de l'économie,Économie,"Sciences Po Paris, ENS, ENA","Direction générale du Trésor, Inspection générale des finances, Commission européenne",,,,,,,
Emmanuel Moulin,people,Gouvernement,Directeur du cabinet,Économie,"Sciences Po Paris, ENA (promotion Victor Schœlcher), ESSEC","Mediobanca, Banque mondiale, Citigroup, Groupe Eurotunnel, Club de Paris",Les Républicains,,"440, 442",,,,
Jennifer Pizzicara,people,Gouvernement,"Chef de cabinet, en charge des relations avec le Parlement",Économie,,,,,,,,,
Juliette Oury,people,Gouvernement,Conseillère affaires européennes et internationales,Économie,"Sciences Po Paris, ENA","Direction générale du Trésor, Commission européenne",,,,Judaïsme ?,,,
Magali Valente,people,Gouvernement,Conseillère fiscalité et chargée des relations avec le Parlement,Économie,,CSA,Les Républicains,,,,,,
Malo Carton,people,Gouvernement,Conseiller entreprises et participations de l'État,Économie,"Polytechnique, Corps des Mines","Agence des Participations de l'Etat, Alstom",,,,,,,
Sarah Finkelstein,people,Gouvernement,Conseillère attractivité et consommation,Économie,"Sciences Po Paris, ENA (promotion Jean de la Fontaine), ESSEC",Direction générale du Trésor,Les Républicains,,,Judaïsme,,,
Sébastien Guérémy,people,Gouvernement,Conseiller industrie et innovation,Économie,"Polytechnique, Corps des Mines","Agence des Participations de l'Etat, SNCF, Air France",,,,,,,
Thomas Revial,people,Gouvernement,Directeur adjoint du cabinet,Économie,"Polytechnique, ENA","Direction générale du Trésor, France Stratégie, Inspection des finances, Banque mondiale, Conseil de l'Union européenne",,,,,,,
Yves-Marie Cann,people,Gouvernement,Conseiller presse et communication,Économie,,"ELABE, CSA, IFOP",,,,,,,
Anna-Livia Susini-Collomb,people,Gouvernement,"Conseillère jeunesse, en charge des relations internationales",Éducation nationale,,,,,,,,,
Antoine Evennou,people,Gouvernement,"Chef de cabinet, conseiller vie associative",Éducation nationale,,"Groupe Macif, MGEN, FCPE, UNL, Association Française pour les Nations Unies",,,,,,,
Christophe Kerrero,people,Gouvernement,Directeur du cabinet,Éducation nationale,,,Les Républicains,,,,,,
Christophe Pacohil,people,Gouvernement,Chef de Cabinet,Éducation nationale,,ESSEC,Les Républicains,,,,,,
David Knecht,people,Gouvernement,Conseiller budgétaire et numérique,Éducation nationale,,,,,,Judaïsme ? Nom alsacien ?,,,
Fanny Anor,people,Gouvernement,Directrice du cabinet et conseillère spéciale,Éducation nationale,ENS,,,,,,,,
Gabriel Attal,people,Gouvernement,Secrétaire d’État auprès du ministre de l’Éducation nationale et de la Jeunesse,Éducation nationale,Sciences Po Paris,Académie de France à Rome - Villa Médicis,Parti socialiste,,458,"Judaïsme, Homosexuel, pacsé avec Stéphane Sejourné",,,
Isabelle Bourhis,people,Gouvernement,"Conseillère sociale, partenariats et vie scolaire",Éducation nationale,,SNPDEN-UNSA,,,,,,,
Jean-Michel Blanquer,people,Gouvernement,Ministre de l'Éducation nationale et de la Jeunesse,Éducation nationale,Sciences Po Paris,ESSEC,Les Républicains,,365,Grande Loge de France https://blogs.lexpress.fr/lumiere-franc-macon/2017/11/26/blanquer-son-show-chez-les-freres-gldf,,,
Louis Jublin,people,Gouvernement,"Conseiller communication, en charge des relations avec le Parlement",Éducation nationale,,"Albera Conseil, Havas",Les Républicains,,,,,,
Marie Dutertre,people,Gouvernement,Conseillère parlementaire,Éducation nationale,Sciences Po Paris,"Groupe Casino, APCO Worldwide",Parti socialiste,,,,,,
Matthieu Lahaye,people,Gouvernement,"Conseiller discours, mémoire, culture, langues régionales",Éducation nationale,,,,,,,,,
Perrine Dufoix,people,Gouvernement,Conseillère presse et communication,Éducation nationale,,,Les Républicains,,,,,,
Raphaël Muller,people,Gouvernement,Directeur adjoint du cabinet,Éducation nationale,"Sciences Po Paris, ENS",ESSEC,Les Républicains,,,,,,
Thierry Ledroit,people,Gouvernement,Conseiller territoires et politiques interministérielles,Éducation nationale,,,,,,,,,
Vincent Stanek,people,Gouvernement,Conseiller affaires pédagogiques,Éducation nationale,ENS,,,,,,,,
Amandine Pasquier,people,Gouvernement,Conseillère en charge des droits des femmes,Égalité Femmes Hommes,,"État-Major des Armées, Suez",Les Républicains,,,Pas sûr pour Les Républicains,,,
Anne Rubinstein,people,Gouvernement,Directrice de cabinet,Égalité Femmes Hommes,,La Poste,Parti socialiste,,,Judaïsme,,,
Marlène Schiappa,people,Gouvernement,"Secrétaire d'État auprès du Premier ministre, chargée de l'Égalité entre les femmes et les hommes et de la Lutte contre les discriminations",Égalité Femmes Hommes,,"Yahoo!, Havas, Bondy Blog, Lagardère",Parti socialiste,,435,Judaïsme,,,
Mathieu Pontécaille,people,Gouvernement,"Conseiller spécial, chargé de la stratégie communication et de la presse",Égalité Femmes Hommes,,,Parti socialiste,,,,,,
Stéphanie Lozano,people,Gouvernement,Chef de cabinet,Égalité Femmes Hommes,,,Parti socialiste,,,,,,
Thomas Brisson,people,Gouvernement,Directeur adjoint du cabinet,Égalité Femmes Hommes,,IFRI,Parti socialiste,,,,,,
Anne-Sophie Barthez,people,Gouvernement,Conseillère formations,Enseignement supérieur,,,,,,,,,
David Cavaillolès,people,Gouvernement,"Conseiller budgétaire, industrie et spatial",Enseignement supérieur,"Polytechnique, Corps des Mines","Inspection générale des finances, Autorité de contrôle prudentiel et de résolution, AXA",,,,,,,
Frédérique Vidal,people,Gouvernement,"Ministre de l'enseignement supérieur, de la recherche et de l'innovation",Enseignement supérieur,,,,,,,,,
Graig Monetti,people,Gouvernement,"Chef de cabinet, conseiller jeunesse et vie étudiante",Enseignement supérieur,,Acadomia,,,,,,,
Isabelle Richard-Cremieux,people,Gouvernement,Conseillère Santé,Enseignement supérieur,,,,,,"Judaïsme ? Son nom complet est Isabelle Richard-Cremieux, donc mariée à un juif ?",,,
Jean-Philippe Bourgoin,people,Gouvernement,Conseiller recherche,Enseignement supérieur,ENS,CEA,,,,,,,
Lloyd Cerqueira,people,Gouvernement,"Conseiller parlemenatire, collectivités territoriales et immobilier",Enseignement supérieur,Sciences Po Paris,,Union des démocrates et indépendants,,,,,,
Marie Francolin,people,Gouvernement,Conseillère en charge de la communication et de la presse,Enseignement supérieur,Sciences Po Paris,"Commission européenne, OCDE, Mairie de Paris",Parti socialiste,,,,,,
Nicolas Castoldi,people,Gouvernement,Directeur de cabinet,Enseignement supérieur,"Sciences Po Paris, ENS",CNRS,Les Républicains,,,,,,
Pauline Pannier,people,Gouvernement,Directrice adjointe,Enseignement supérieur,ENA,Conseil d’État,,,,,,,
Yedidia Levy-Zauberman,people,Gouvernement,Conseiller spécial en charge des affaires politiques et diplomatiques,Enseignement supérieur,Sciences Po Paris,"Mairie de Paris, Natixis, Deloitte, Dahlia Partners",Parti socialiste,,445,"Judaïsme, Eclaireuses et Eclaireurs israélites de France",,,
Elsa Faucillon,people,Assemblée nationale,Affaires culturelles et éducation,Gauche démocrate et républicaine,,,,,,,Groupe d'amitié France-Israël,Hauts-de-Seine,Ile-de-France
Marie-George Buffet,people,Assemblée nationale,Affaires culturelles et éducation,Gauche démocrate et républicaine,,,,,"29, 32, 33, 35, 44, 51, 56, 60, 63, 65, 70, 71, 72, 73, 74, 76, 81, 86, 93, 94, 97, 101, 103, 107, 119, 133, 139",,Groupe d'études : discriminations et lgbtqi-phobies dans le monde,Seine-Saint-Denis,Ile-de-France
Alain Bruneel,people,Assemblée nationale,Affaires économiques,Gauche démocrate et républicaine,,,,,,,,Nord,Hauts-de-France
Sébastien Jumel,people,Assemblée nationale,Affaires économiques,Gauche démocrate et républicaine,,,,,,,,Seine-Maritime,Normandie
Jean-Paul Lecoq,people,Assemblée nationale,Affaires étrangères,Gauche démocrate et républicaine,,,,,,,"Groupe d'amitié France-Israël, Groupe d'études : conditions d'accueil des migrants, Groupe d'études : discriminations et lgbtqi-phobies dans le monde",Seine-Maritime,Normandie
Moetai Brotherson,people,Assemblée nationale,Affaires étrangères,Gauche démocrate et républicaine,,,,,,,,Polynésie Française,Polynésie française
Jean-Philippe Nilor,people,Assemblée nationale,Affaires sociales,Gauche démocrate et républicaine,,,,,,,,Martinique,Martinique
Pierre Dharréville,people,Assemblée nationale,Affaires sociales,Gauche démocrate et républicaine,,,,,,,,Bouches-du-Rhône,Provence-Alpes-Côte d'Azur
André Chassaigne,people,Assemblée nationale,Défense,Gauche démocrate et républicaine,,,,,,,Groupe d'amitié France-Israël,Puy-de-Dôme,Auvergne-Rhône-Alpes
Manuéla Kéclard-Mondésir,people,Assemblée nationale,Défense,Gauche démocrate et républicaine,,,,,,,,Martinique,Martinique
Gabriel Serville,people,Assemblée nationale,Développement durable,Gauche démocrate et républicaine,,,,,,,,Guyane,Guyane
Hubert Wulfranc,people,Assemblée nationale,Développement durable,Gauche démocrate et républicaine,,,,,,,,Seine-Maritime,Normandie
Fabien Roussel,people,Assemblée nationale,Finances,Gauche démocrate et républicaine,,,,,31,,,Nord,Hauts-de-France
Stéphane Peu,people,Assemblée nationale,Finances,Gauche démocrate et républicaine,,,,,24,Grand Orient de France,Commission d'enquête sur la lutte contre les groupuscules d'extrême droite en France,Seine-Saint-Denis,Ile-de-France
Huguette Bello,people,Assemblée nationale,Lois,Gauche démocrate et républicaine,,,,,192,,,Réunion,Réunion
Jean-Paul Dufrègne,people,Assemblée nationale,Lois,Gauche démocrate et républicaine,,,,,,,,Allier,Auvergne-Rhône-Alpes
Cathy Apourceau-Poly,people,Sénat,,"Groupe Communiste, républicain, citoyen et écologiste ",,,,,,,,Pas-de-Calais,Hauts-de-France
Cécile Cukierman,people,Sénat,,"Groupe Communiste, républicain, citoyen et écologiste ",,,,,,Judaïsme,,Loire,Auvergne-Rhône-Alpes
