node,type,area,position,group,education,employer,political party,religion,reference,comments,membership,seat,,
Maud Petit,people,Assemblée nationale,Affaires culturelles et éducation,Mouvement démocrate,,,,,,,Intergroupe de la LICRA,262,Val-de-Marne,Ile-de-France
Philippe Berta,people,Assemblée nationale,Affaires culturelles et éducation,Mouvement démocrate,,,,,,,Intergroupe de la LICRA,164,Gard,Occitanie
Nicolas Turquois,people,Assemblée nationale,Affaires économiques,Mouvement démocrate,,,,,,,Intergroupe de la LICRA,265,Vienne,Nouvelle-Aquitaine
Marielle de Sarnez,people,Assemblée nationale,Affaires étrangères,Mouvement démocrate,,,,,,,Intergroupe de la LICRA,257,Paris,Ile-de-France
Patricia Gallerneau,people,Assemblée nationale,Développement durable,Mouvement démocrate,,,,,,,Intergroupe de la LICRA,111,Vendée,Pays de la Loire
Jean-Noël Barrot,people,Assemblée nationale,Finances,Mouvement démocrate,,,,,,,Intergroupe de la LICRA,167,Yvelines,Ile-de-France
Mohamed Laqhila,people,Assemblée nationale,Finances,Mouvement démocrate,,,,,,,Intergroupe de la LICRA,250,Bouches-du-Rhône,Provence-Alpes-Côte d'Azur
Sarah El Haïry,people,Assemblée nationale,Finances,Mouvement démocrate,,,,,,,Intergroupe de la LICRA,172,Loire-Atlantique,Pays de la Loire
Isabelle Florennes,people,Assemblée nationale,Lois,Mouvement démocrate,,,,,,,Intergroupe de la LICRA,177,Hauts-de-Seine,Ile-de-France
Géraldine Bannier,people,Assemblée nationale,Affaires culturelles et éducation,Mouvement démocrate,,,,,,,,163,Mayenne,Pays de la Loire
Sophie Mette,people,Assemblée nationale,Affaires culturelles et éducation,Mouvement démocrate,,,,,,,,256,Gironde,Nouvelle-Aquitaine
Marguerite Deprez-Audebert,people,Assemblée nationale,Affaires économiques,Mouvement démocrate,,,,,,,,170,Pas-de-Calais,Hauts-de-France
Max Mathiasin,people,Assemblée nationale,Affaires économiques,Mouvement démocrate,,,,,,,,189,Guadeloupe,Guadeloupe
Philippe Bolo,people,Assemblée nationale,Affaires économiques,Mouvement démocrate,,,,,,,,166,Maine-et-Loire,Pays de la Loire
Richard Ramos,people,Assemblée nationale,Affaires économiques,Mouvement démocrate,,,,,,,,264,Loiret,Centre-Val de Loire
Bruno Fuchs,people,Assemblée nationale,Affaires étrangères,Mouvement démocrate,,,,,,,,181,Haut-Rhin,Grand Est
Frédéric Petit,people,Assemblée nationale,Affaires étrangères,Mouvement démocrate,,,,,,,,260,Français établis hors de France,Français établis hors de France
Michel Fanget,people,Assemblée nationale,Affaires étrangères,Mouvement démocrate,,,,,,,,175,Puy-de-Dôme,Auvergne-Rhône-Alpes
Cyrille Isaac-Sibille,people,Assemblée nationale,Affaires sociales,Mouvement démocrate,,,,,,,,184,Rhône,Auvergne-Rhône-Alpes
Justine Benin,people,Assemblée nationale,Affaires sociales,Mouvement démocrate,,,,,,,,258,Guadeloupe,Guadeloupe
Michèle de Vaucouleurs,people,Assemblée nationale,Affaires sociales,Mouvement démocrate,,,,,,,,401,Yvelines,Ile-de-France
Nathalie Elimas,people,Assemblée nationale,Affaires sociales,Mouvement démocrate,,,,,,,,173,Val-d'Oise,Ile-de-France
Patrick Mignola,people,Assemblée nationale,Affaires sociales,Mouvement démocrate,,,,,,,,180,Savoie,Auvergne-Rhône-Alpes
Jean-Pierre Cubertafon,people,Assemblée nationale,Défense,Mouvement démocrate,,,,,,,,169,Dordogne,Nouvelle-Aquitaine
Josy Poueyto,people,Assemblée nationale,Défense,Mouvement démocrate,,,,,,,,263,Pyrénées-Atlantiques,Nouvelle-Aquitaine
Philippe Michel-Kleisbauer,people,Assemblée nationale,Défense,Mouvement démocrate,,,,,,,,259,Var,Provence-Alpes-Côte d'Azur
Stéphane Baudu,people,Assemblée nationale,Défense,Mouvement démocrate,,,,,,,,248,Loir-et-Cher,Centre-Val de Loire
Aude Luquet,people,Assemblée nationale,Développement durable,Mouvement démocrate,,,,,,,,254,Seine-et-Marne,Ile-de-France
Bruno Duvergé,people,Assemblée nationale,Développement durable,Mouvement démocrate,,,,,,,,171,Pas-de-Calais,Hauts-de-France
Bruno Millienne,people,Assemblée nationale,Développement durable,Mouvement démocrate,,,,,,,,178,Yvelines,Ile-de-France
Jimmy Pahun,people,Assemblée nationale,Développement durable,Mouvement démocrate,,,,,,,,188,Morbihan,Bretagne
Jean-Louis Bourlanges,people,Assemblée nationale,Finances,Mouvement démocrate,,,,,,,,165,Hauts-de-Seine,Ile-de-France
Jean-Paul Mattei,people,Assemblée nationale,Finances,Mouvement démocrate,,,,,,,,255,Pyrénées-Atlantiques,Nouvelle-Aquitaine
Élodie Jacquier-Laforge,people,Assemblée nationale,Lois,Mouvement démocrate,,,,,,,,185,Isère,Auvergne-Rhône-Alpes
Erwan Balanant,people,Assemblée nationale,Lois,Mouvement démocrate,,,,,,,,162,Finistère,Bretagne
Vincent Bru,people,Assemblée nationale,Lois,Mouvement démocrate,,,,,,,,168,Pyrénées-Atlantiques,Nouvelle-Aquitaine
Robert Navarro,people,Sénat,,Non-inscrits,,SNCF,Parti socialiste,,,Grand Orient de France,,,Hérault,Occitanie
Louis Aliot,people,Assemblée nationale,Défense,Non-inscrits,,,,,,Judaïsme,,59,Pyrénées-Orientales,Occitanie
Jean Lassalle,people,Assemblée nationale,Affaires étrangères,Non-inscrits,,,,,,,Groupe d'amitié France-Israël,426,Pyrénées-Atlantiques,Nouvelle-Aquitaine
Sébastien Chenu,people,Assemblée nationale,Affaires sociales,Non-inscrits,,,,,,,Groupe d'amitié France-Israël,57,Nord,Hauts-de-France
Claudine Kauffmann,people,Sénat,,Non-inscrits,,,Front national,,,,Groupe d'amitié France-Israël,,Var,Provence-Alpes-Côte d'Azur
Delphine Batho,people,Assemblée nationale,Affaires économiques,Non-inscrits,,,,,339,,"Groupe d'amitié France-Israël, Groupe d'études : antisémitisme, Intergroupe de la LICRA",639,Deux-Sèvres,Nouvelle-Aquitaine
Emmanuelle Ménard,people,Assemblée nationale,Lois,Non-inscrits,,,,,,,"Groupe d'études : antisémitisme, Groupe d'études : conditions d'accueil des migrants",68,Hérault,Occitanie
Marie-France Lorho,people,Assemblée nationale,Lois,Non-inscrits,,,,,,,"Groupe d'études : antisémitisme, Groupe d'études : discriminations et lgbtqi-phobies dans le monde",67,Vaucluse,Provence-Alpes-Côte d'Azur
Sébastien Nadot,people,Assemblée nationale,Affaires étrangères,Non-inscrits,,,La République en Marche,,,,"Groupe d'études : conditions d'accueil des migrants, Groupe d'études : discriminations et lgbtqi-phobies dans le monde, Intergroupe de la LICRA",637,Haute-Garonne,Occitanie
Matthieu Orphelin,people,Assemblée nationale,Développement durable,Non-inscrits,,"Agence de l'environnement et de la maîtrise de l'énergie, Fondation Nicolas Hulot",La République en Marche,,,,Intergroupe de la LICRA,636,Maine-et-Loire,Pays de la Loire
Bruno Bilde,people,Assemblée nationale,Affaires culturelles et éducation,Non-inscrits,,,,,,,,66,Pas-de-Calais,Hauts-de-France
José Evrard,people,Assemblée nationale,Affaires économiques,Non-inscrits,,,,,,,,236,Pas-de-Calais,Hauts-de-France
Ludovic Pajot,people,Assemblée nationale,Affaires économiques,Non-inscrits,,,,,,,,56,Pas-de-Calais,Hauts-de-France
Marine Le Pen,people,Assemblée nationale,Affaires étrangères,Non-inscrits,,,,,,,,60,Pas-de-Calais,Hauts-de-France
Nicolas Dupont-Aignan,people,Assemblée nationale,Affaires étrangères,Non-inscrits,,,,,204,,,237,Essonne,Ile-de-France
André Gattolin,people,Sénat,,Non-inscrits,,"CSA, Ipsos, Libération, The Gallup Organization, Actuel",Europe Écologie Les Verts,,,,,,Hauts-de-Seine,Ile-de-France
Christine Herzog,people,Sénat,,Non-inscrits,,,,,,,,,Moselle,Grand Est
Jean-Louis Masson,people,Sénat,,Non-inscrits,,,,,,,,,Moselle,Grand Est
Jean-Noël Guérini,people,Sénat,,Non-inscrits,,,,,,,,,Bouches-du-Rhône,Provence-Alpes-Côte d'Azur
Mireille Jouve,people,Sénat,,Non-inscrits,,,,,,,,,Bouches-du-Rhône,Provence-Alpes-Côte d'Azur
Philippe Adnot,people,Sénat,,Non-inscrits,,,Mouvement démocrate,,,,,,Aube,Grand Est
Ronan Dantec,people,Sénat,,Non-inscrits,,,Europe Écologie Les Verts,,,,,,Loire-Atlantique,Pays de la Loire
Stéphane Ravier,people,Sénat,,Non-inscrits,,,,,,,,,Bouches-du-Rhône,Provence-Alpes-Côte d'Azur
Orianne Ledroit,people,Gouvernement,"Conseillère inclusion, territoires, entrepreneuriat social numériques et environnement",Numérique,,"Mission Société Numérique, La MedNum, Retiss, Le Sentier",Parti socialiste,,,Ancienne collaboratrice parlementaire de Philippe Doucet,,,,
Cédric O,people,Gouvernement,"Secrétaire d'État auprès du ministre de l’Économie et des Finances et du ministre de l’Action et des Comptes publics, chargé du Numérique",Numérique,HEC,Safran,Parti socialiste,,,Frère de Delphine O,,,,
Thomas Bajas,people,Gouvernement,Chef adjoint de cabinet,Numérique,,"EY, Meridiam, TRIBU, BNP Paribas",,,,,,,,
Nicolas Vignolles,people,Gouvernement,"Chef de cabinet, conseiller parlementaire",Numérique,,"France Digitale, Make.org, Euro RSCG",Parti socialiste,,,,,,,
Florian Humez,people,Gouvernement,"Chef de cabinet, en charge des relations avec les élus",Numérique,,"Assemblée nationale (Conseiller parlementaire chargé des relations avec les élus de François de Rugy), RCI Bank and Services, Crédit Coopératif, Caisse d'Epargne",Parti socialiste,,,,,,,
Philippe Englebert,people,Gouvernement,Conseiller entreprises et technologies,Numérique,,"Direction générale du Trésor, Inspection des finances, Goldman Sachs",,,,,,,,
Antoine Boscher,people,Gouvernement,"Conseiller spécial, chargé de la communication et de la presse",Numérique,,,,,,,,,,
Yolaine Proult,people,Gouvernement,Conseillère innovation publique et inclusion numérique,Numérique,Sciences Po Paris,"BETC, Pepsi",,,,,,,,
Carole Vachet,people,Gouvernement,"Directrice adjointe de cabinet, en charge des régulations numériques et du suivi de l'exécution des réformes",Numérique,ENA,Direction générale du Trésor,,,,,,,,
Aude Costa de Beauregard,people,Gouvernement,Conseillère transformation numérique de l'État et régulations,Numérique,HEC,"Direction interministérielle de la transformation publique, Lulu dans ma rue, Pôle emploi, Direction Générale de la Modernisation de l'État, Ministère du Budget, des comptes publics, de la fonction publique et de la réforme de l'État",,,,,,,,
Antoine Darodes,people,Gouvernement,Directeur de cabinet,Numérique,,"Autorité de régulation des communications électroniques et des postes, Autorité de la concurrence",,,,,,,,
Matthieu Heurtel,people,Gouvernement,Conseiller technique écosystèmes et innovation,Numérique,"Polytechnique, École des Ponts ParisTech","Ministère de la Cohésion des territoires, Groupe Caisse des Dépôts, Goldman Sachs (stagiaire), BNP Paribas (stagiaire), Gendarmerie Nationale (Lieutenant adjoint au commandant de compagnie)",,,,,,,,
Nicolas Gaudemet,people,Gouvernement,Directeur de cabinet,Numérique,"Polytechnique, Stanford","Fnac, Orange",,,,,,,,
Raphaëlle Séguin,people,Gouvernement,"Conseillère chargée du budget, de l'investissement public, du logement, du développement territorial et des infrastructures maritimes",Outre-Mer,,,,,,Aucune information en ligne,,,,
Annick Girardin,people,Gouvernement,Ministre des outre-mer,Outre-Mer,,,"Parti radical de gauche, Cap sur l'avenir",,377,,Intergroupe de la LICRA,,,
Fabrice Thibier,people,Gouvernement,Chef de cabinet,Outre-Mer,,EY,,,,,,,,
Michaela Rusnac,people,Gouvernement,"Conseillère, en charge de l'action sociale et du développement humain",Outre-Mer,,"Ministère de la santé, Éducation nationale, Agence nationale de sécurité du médicament et des produits de santé, Ferring, Procter & Gamble",,,,,,,,
Martin Parent,people,Gouvernement,"Conseiller chargé des affaires stratégiques, de la trajectoire 5.0 et du suivi de l'exécution des réformes",Outre-Mer,,"Agence Française de Développement, Ministère des Affaires étrangères",Parti socialiste,,,,,,,
Nicolas Sire,people,Gouvernement,"Conseiller en charge de la communication, des relations avec la presse et de la culture",Outre-Mer,,TBWA Corporate,Parti socialiste,,,,,,,
Benoît Bayard,people,Gouvernement,Conseiller en charge des affaires économiques,Outre-Mer,,,,,,,,,,
Alizée Bombardier,people,Gouvernement,"Conseillère parlementaire, en charge des relations avec les élus, des associations, de la jeunesse et des sports",Outre-Mer,,Ministère de la Fonction publique,Cap sur l'Avenir,,,,,,,
Afif Lazrak,people,Gouvernement,"Conseiller en charge des affaires régaliennes, de l'action publique",Outre-Mer,IRA Bastia,,,,,,,,,
Anne Skrobot,people,Gouvernement,"Conseillère en charge des affaires européennes, de l'agriculture, de la pêche, de l'éducation et de la recherche au cabinet de la ministre des outre-mer",Outre-Mer,,"Ecole des relations Internationales, Sciences Po Toulouse, Aix-Marseille Université, OSCE, OTAN, Secrétariat général des affaires européennes (SGAE), AP-HP, Assistance Publique - Hôpitaux de Paris, European Union Election Obervation Mission, Conseil supérieur de l'audiovisuel",,,,,,,,
Sandra Reviriego,people,Gouvernement,Conseillère parlementaire,Outre-Mer,,Conseil Régional Ile de France,Parti socialiste,,,,,,,
Brice Blondel,people,Gouvernement,Directeur adjoint de cabinet,Outre-Mer,ENA,Cour des comptes,,,,,,,,
Baptiste Blanchard,people,Gouvernement,Conseiller chargé des questions environnementales et des transports,Outre-Mer,,"Ministère de l'Écologie, Direction départementale des territoires de l'Essonne, DREAL Alsace, Direction régionale de l'environnement d'Alsace, DIREN Alsace",,,,,,,,
Xavier Ducept,people,Gouvernement,Directeur du cabinet,Outre-Mer,Saint-Cyr,Général de brigade,,,,,,,,
Lionel Choukroun,people,Gouvernement,"Chef de cabinet, conseiller politique et affaires réservées",Porte-parole du gouvernement,,"Alstom, France Télévisions",,,,"Judaïsme, Homosexuel",,,,
Constantin De Salvatore,people,Gouvernement,Conseiller,Porte-parole du gouvernement,,,Parti socialiste,,,,,,,
Marie Quinette,people,Gouvernement,Conseillère stratégie digitale,Porte-parole du gouvernement,,Publicis,,,,,,,,
Clara Koenig,people,Gouvernement,Conseillère,Porte-parole du gouvernement,"Sciences Po Paris, HEC",,,,,,,,,
Morgane Le Poul,people,Gouvernement,Conseillère presse et porte-parolat,Porte-parole du gouvernement,Sciences Po Paris,"Burson Cohn & Wolfe, APc Affaires Publiques, Havas (stagiaire), Parlement européen (stagiaire), Sénat (stagiaire)",,,,,,,,
Marianne Zalc-Müller,people,Gouvernement,Conseillère spéciale,Porte-parole du gouvernement,Sciences Po Paris,,Parti socialiste,,444,,,,,
Nicolas Escoulan,people,Gouvernement,Directeur de cabinet ,Porte-parole du gouvernement,,"TF1, Canal+, Europe 1",,,,,,,,
Laurence Tison-Vuillaume,people,Gouvernement,Directrice de cabinet,Porte-parole du gouvernement,"HEC, ENA",,,,,,,,,
Sibeth Ndiaye,people,Gouvernement,"Secrétaire d'État auprès du Premier ministre, porte-parole du Gouvernement",Porte-parole du gouvernement,,LMDE,Parti socialiste,,,,,,,
Laurent Martel,people,Gouvernement,"Conseiller fiscalité, prélèvements obligatoires et participations publiques",Premier Ministre,"Sciences Po Paris, ENA",,Parti socialiste,,,À la fois au cabinet de la Présidence et du Premier-Ministre,,,,
Jonathan Nussbaumer,people,Gouvernement,"Conseiller technique industrie, commerce et artisanat",Premier Ministre,"Polytechnique, Mines ParisTech",L'Oréal,,,,À la fois au cabinet de la Présidence et du Premier-Ministre,,,,
Tristan Barrès,people,Gouvernement,Conseiller technique logement,Premier Ministre,,,Parti socialiste,,,À la fois au cabinet de la Présidence et du Premier-Ministre,,,,
Charles-Henri Weymuller,people,Gouvernement,Conseiller technique macro-économie [et politiques commerciales],Premier Ministre,"Polytechnique, Mines ParisTech, Harvard","FMI, PSA, Morgan Stanley, FED",,,,À la fois au cabinet de la Présidence et du Premier-Ministre,,,,
Jimmy Brun,people,Gouvernement,Conseiller technique transports,Premier Ministre,Polytechnique,Commission européenne,,,,À la fois au cabinet de la Présidence et du Premier-Ministre,,,,
Grégory-Hugues Frély,people,Gouvernement,Conseiller technique sécurité intérieure,Premier Ministre,,,,,,Aucune information en ligne,,,,
Pierre Pellissier,people,Gouvernement,Conseiller porte-parolat,Premier Ministre,Sciences Po Paris,,,,,,,,,
Robin Gastaldi ,people,Gouvernement,Conseiller porte-parolat,Premier Ministre,,,,,,,,,,
Mohamed Hamrouni,people,Gouvernement,Chef adjoint de cabinet,Premier Ministre,,"TF1, Gemalto",Les Républicains,,,Islam,,,,
Maïa Wirgin,people,Gouvernement,"Conseillère culture, communication, régulation numérique (chef de pôle)",Premier Ministre,ENA (promotion Simone Veil),"Radio France, Public Sénat, Cour des comptes, Mairie de Paris",,,,Judaïsme,,,,
Eve Zuckerman,people,Gouvernement,Conseillère technique communication digitale,Premier Ministre,,"Food & Water Watch, Organizing for Action, 270 Strategies, Democrats Abroad, Le Figaro",Les Républicains,,,Judaïsme,,,,
Daniel Zielinski,people,Gouvernement,Conseiller technique jeunesse et sports,Premier Ministre,,,Parti socialiste,,,Judaïsme ? Nom souvent porté par des juifs askhénazes,,,,
Francois-Antoine Mariani,people,Gouvernement,Conseiller technique politiques contractuelles territoriales,Premier Ministre,,,Les Républicains,,,Pas sûr pour Les Républicains,,,,
Emmanuel Lenain,people,Gouvernement,Conseiller diplomatique (chef de pôle),Premier Ministre,"ENA, ESSEC, Sciences Po Paris",,,,,Young Leaders 2010,,,,
Nolwenn Chouffot,people,Gouvernement,Chargée de mission auprès des conseillers pour les affaires intérieures,Premier Ministre,,,,,,,,,,
Anne Clerc,people,Gouvernement,Chef de cabinet,Premier Ministre,,,"Mouvement démocrate, Les Républicains",,,,,,,
Charlotte Mailly,people,Gouvernement,"Chef de cabinet adjointe, chef du secrétariat particulier",Premier Ministre,,Hubert Védrine Conseil,Les Républicains,,,,,,,
Hélène Hamelle,people,Gouvernement,"Porte-parole du Gouvernement, conseillère auprès de la ministre, en charge de l'exécution des réformes",Premier Ministre,Sciences Po Paris,"Plead, Havas, Agence Little Wing, Harrison & Wolf",,,,,,,,
Eric Jalon,people,Gouvernement,Conseiller affaires intérieures (chef de pôle) ,Premier Ministre,"ENA (promotion Valmy), ENS",,Les Républicains,,,,,,,
Gilles Boyer,people,Gouvernement,Conseiller auprès du Premier ministre,Premier Ministre,,"Groupe Casino, M6",Les Républicains,,,,,,,
Charles Hufnagel,people,Gouvernement,Conseiller communication,Premier Ministre,Sciences Po Paris,"Orano, Saint-Gobain",Les Républicains,,,,,,,
Olivier Courson,people,Gouvernement,"Conseiller culture, communication, régulation numérique (chef de pôle)",Premier Ministre,ENA,Canal+,Parti socialiste,,,,,,,
Damien Cazé,people,Gouvernement,"Conseiller écologie, transports, énergie, logement et agriculture (chef de pôle)",Premier Ministre,"ENA, ESSEC, Sciences Po Paris",,,,,,,,,
Antoine Saintoyant,people,Gouvernement,"Conseiller économie, finances, industrie (chef de pôle)",Premier Ministre,"Sciences Po Paris, ENA",,,,,,,,,
Xavier Brunetière,people,Gouvernement,Conseiller outre-mer (adjoint au chef de pôle),Premier Ministre,"Sciences Po Paris, ENA",,Les Républicains,,,,,,,
Xavier Chinaud,people,Gouvernement,Conseiller relations politiques et relations avec les élus (chef de pôle),Premier Ministre,,ESL & Network,"Démocratie Libérale, Les Républicains",,,,,,,
Franck Morel,people,Gouvernement,"Conseiller relations sociales, travail, emploi, formation professionnelle",Premier Ministre,"ENA, HEC",,Les Républicains,,,,,,,
Franck Von Lennep,people,Gouvernement,"Conseiller santé, protection sociale, politiques sociales (chef de pôle)",Premier Ministre,,,,,,,,,,
Etienne Ranaivoson,people,Gouvernement,Conseiller technique affaires européennes,Premier Ministre,,,,,,,,,,
Pierre Regnault de La Mothe,people,Gouvernement,Conseiller technique affaires intérieures,Premier Ministre,ENA,,Les Républicains,,,,,,,
Stephen Marchisio,people,Gouvernement,Conseiller technique affaires stratégiques,Premier Ministre,,,,,,,,,,
Jean-Baptiste Minato,people,Gouvernement,Conseiller technique budget,Premier Ministre,Polytechnique,BNP Paribas,,,,,,,,
Mohammed Adnène Trojette,people,Gouvernement,Conseiller technique numérique,Premier Ministre,"ENA, Sciences Po Paris, Ecole centrale de Paris","Cour des comptes, Commission européenne",,,,,,,,
Adrien Caillerez,people,Gouvernement,Conseiller technique parlementaire,Premier Ministre,IEP Lyon,,Les Républicains,,,,,,,
Benoît Planchard,people,Gouvernement,Conseiller technique parlementaire,Premier Ministre,,,Parti socialiste,,,,,,,
Victor Pace,people,Gouvernement,Conseiller technique presse,Premier Ministre,LSE,"Brunswick Group, AXA",,,,,,,,
Thomas Lombes,people,Gouvernement,Conseiller technique recherche innovation,Premier Ministre,"ENS, Polytechnique, Corps des mines","Orano, Oxford University",,,,,,,,
Francis Decoux,people,Gouvernement,Conseiller technique relations avec les élus,Premier Ministre,,,"Démocratie Libérale, Les Républicains",,,,,,,
Guillaume Couillard,people,Gouvernement,Conseiller technique santé,Premier Ministre,Polytechnique,"Hospices Civils de Lyon, Sécurité sociale, Direction générale de la modernisation de l'Etat",,,,,,,,
Édouard Solier,people,Gouvernement,"Conseiller technique, discours",Premier Ministre,"HEC, Sciences Po Paris",,Les Républicains,,,,,,,
Marie Reynier,people,Gouvernement,"Conseillère éducation, enseignement supérieur, jeunesse et sports (chef de pôle)",Premier Ministre,,Arts et Métiers ParisTech,,,,,,,,
Sandrine Gaudin,people,Gouvernement,Conseillère Europe (chef de pôle),Premier Ministre,,,,,,,,,,
Charlotte Caubel,people,Gouvernement,Conseillère justice (chef de pôle),Premier Ministre,"ENM, Sciences Po Paris",Tracfin,,,,,,,,
Fanny Le Luel,people,Gouvernement,Conseillère parlementaire (chef de pôle),Premier Ministre,,,Union des démocrates et indépendants,,,,,,,
Zélia Césarion,people,Gouvernement,Conseillère presse,Premier Ministre,,,Les Républicains,,,,,,,
Mélanie Villiers,people,Gouvernement,Conseillère technique collectivités territoriales et aménagement du territoire,Premier Ministre,ENA,Commission européenne,,,,,,,,
Sylvie Corréard,people,Gouvernement,Conseillère technique culture et communication,Premier Ministre,,"DIRE, Fémis",Parti socialiste,,,,,,,
Géraldine Dolléans,people,Gouvernement,Conseillère technique discours,Premier Ministre,ENS,,,,,,,,,
Marianne Lucidi,people,Gouvernement,"Conseillère technique fonction publique, réforme de l'État",Premier Ministre,"Sciences Po Paris, ENS, ENA",,,,,,,,,
Florence Hermite,people,Gouvernement,Conseillère technique justice,Premier Ministre,"Sciences Po Paris, LSE",,,,,,,,,
Célia Cauquil-Tellechea,people,Gouvernement,Conseillère technique parlementaire,Premier Ministre,,,Parti socialiste,,,,,,,
Delphine Besson,people,Gouvernement,Conseillère technique parlementaire,Premier Ministre,,,Les Républicains,,,,,,,
Florence Rognard,people,Gouvernement,Conseillère technique parlementaire,Premier Ministre,,,Parti socialiste,,,,,,,
Julie Creuseveau,people,Gouvernement,Conseillère technique presse,Premier Ministre,,,Les Républicains,,,,,,,
Thomas Fatome,people,Gouvernement,Directeur adjoint de cabinet,Premier Ministre,"ENA (promotion Averroès), HEC",Sécurité Sociale,Les Républicains,,,,,,,
Benoît Ribadeau-Dumas,people,Gouvernement,Directeur de cabinet,Premier Ministre,"Polytechnique, ENA (promotion Marc Bloch)","Zodiac Aerospace, CGG, Thales",Les Républicains,,,,,,,
Jean Castex,people,Gouvernement,Premier Ministre,Premier Ministre,ENA,,Les Républicains,,,,,,,
Marguerite Cazeneuve,people,Gouvernement,Conseillère technique protection sociale et comptes sociaux,Présidence,HEC,McKinsey & Company,Parti socialiste,,,À la fois au cabinet de la Présidence et du Premier-Ministre,,,,
Stéphane Sejourné,people,Gouvernement,Conseiller Politique,Présidence,,"L'Alliance 7, Mairie de Paris",Parti socialiste,,,Homosexuel pacsé avec Gabriel Attal,,,,
Constance Bensussan,people,Gouvernement,"Conseillère solidarités, égalité femmes/hommes, lutte contre les discriminations",Présidence,"Sciences Po Paris, ENA, Lomonosov","LCL, DILCRA",,,,Judaïsme,,,,
Alexis Zajdenweber,people,Gouvernement,"Conseiller économie, finances, industrie",Présidence,"Sciences-Po Paris, ENA (promotion René Cassin)","Direction générale du Trésor, Agence des participations de l’État",Parti socialiste,,,Judaïsme,,,,
Alexis Kohler,people,Gouvernement,Secrétaire général de la Présidence,Présidence,"Sciences-Po Paris, ESSEC, ENA (promotion Averroès)",,Parti socialiste,,442,Judaïsme,,,,
Nathanaël Mason-Schuler,people,Gouvernement,Conseiller technique financement de l'économie et investissements,Présidence,"Sciences Po Paris, ENA (promotion Jean-Jacques Rousseau), Harvard",Institut de l'Entreprise,,,,Judaïsme ?,,,,
Soria Blatmann,people,Gouvernement,"Conseillère technique droits humains, francophonie, rayonnement culturel, société civile",Présidence,ENS,"Mairie de Paris, AIDES, Reporters sans frontières RSF",Parti socialiste,,,Judaïsme ?,,,,
Alexandre Adam,people,Gouvernement,Conseiller technique Europe,Présidence,IEP Strasbourg ,,,,,Judaïsme ? Il est strasbourgeois,,,,
Jean Salomon,people,Gouvernement,Administration et Conservation des Résidences Présidentielles,Présidence,,Brigade de sapeurs-pompiers de Paris,,,,Judaïsme ? Le nom de famille Salomon est apparemment fréquent en Haute-Bretagne...,,,,
Joseph Zimet,people,Gouvernement,Conseiller communication,Présidence,,,Parti socialiste,,,"Judaïsme, marié en 2005 à Rama Yade",,,,
Jacques Fayard,people,Gouvernement,Adjoint au chef de l’état-major particulier,Présidence,,"État-Major des Armées, Marine Nationale",,,,,,,,
Jérôme Theillier,people,Gouvernement,Adjoint au chef de l’état-major particulier,Présidence,,"Marine Nationale, Force navale européenne",,,,,,,,
